service,id,name,impact,created_at,resolved_at,duration_minutes,num_updates,num_components,components,shortlink,first_update,created_hour,created_weekday,created_date,created_month,created_year,is_outlier,first_hour_updates,year_month,duration_class
github,00h92ct3ggvv,GitHub audit logs are unavailable,major,2026-04-01 16:06:11.166000+00:00,2026-04-01 16:10:17.528000+00:00,4.1,3,0,[],https://stspg.io/vs91g30yd70s,We are investigating reports of impacted performance for some GitHub services.,16.0,Wednesday,2026-04-01,4.0,2026.0,False,3,2026-04,short
github,tstkmx7pcs5d,Incident with Copilot,minor,2026-04-01 09:58:13.543000+00:00,2026-04-01 12:41:38.233000+00:00,163.4,9,1,['Copilot'],https://stspg.io/2xwjn4t1r8jy,We are investigating reports of degraded performance for Copilot,9.0,Wednesday,2026-04-01,4.0,2026.0,False,4,2026-04,long
github,ml7wplmxbt5l,Incident with Pull Requests: High percentage of 500s,minor,2026-03-31 15:05:39.330000+00:00,2026-03-31 21:23:43.015000+00:00,378.1,11,1,['Pull Requests'],https://stspg.io/lvkqg4h1rntp,We are investigating reports of degraded performance for Pull Requests,15.0,Tuesday,2026-03-31,3.0,2026.0,False,3,2026-03,long
github,2yb2tvwny50l,Issues with metered billing report generation,minor,2026-03-31 13:47:46.091000+00:00,2026-03-31 15:10:22.152000+00:00,82.6,7,0,[],https://stspg.io/4pyzfm2phb3b,We are investigating reports of impacted performance for some GitHub services.,13.0,Tuesday,2026-03-31,3.0,2026.0,False,3,2026-03,long
github,c3ctbhdcvcc8,Elevated delays in Actions workflow runs and Pull Request status updates,minor,2026-03-30 13:02:28.248000+00:00,2026-03-30 13:25:38.683000+00:00,23.2,4,2,"['Pull Requests', 'Actions']",https://stspg.io/q4lmbp37zyrn,We are investigating reports of degraded performance for Actions and Pull Requests,13.0,Monday,2026-03-30,3.0,2026.0,False,4,2026-03,short
github,9vyj2jwsk8by,Incident with Copilot,none,2026-03-27 05:00:00+00:00,2026-03-27 05:00:00+00:00,0.0,1,0,[],https://stspg.io/41dqjldm4dwt,"On March 27, 2026, from 02:30 to 04:56 UTC, a misconfiguration in our rate limiting system caused users on Copilot Free, Student, Pro, and Pro+ plans to experience unexpected rate limit errors. The co",5.0,Friday,2026-03-27,3.0,2026.0,False,0,2026-03,short
github,kp06czybl7dw,Disruption with some GitHub services,minor,2026-03-24 20:18:06.873000+00:00,2026-03-24 20:56:05.273000+00:00,38.0,6,4,"['Webhooks', 'Issues', 'Pull Requests', 'Actions']",https://stspg.io/dl16chvwsj7l,We are investigating reports of degraded performance for Actions,20.0,Tuesday,2026-03-24,3.0,2026.0,False,6,2026-03,short
github,z7gsp4wd05c5,Teams Github Notifications App is down,major,2026-03-24 16:59:27.656000+00:00,2026-03-24 19:51:16.124000+00:00,171.8,5,0,[],https://stspg.io/g3zv7t9bmccs,We are investigating reports of impacted performance for some GitHub services.,16.0,Tuesday,2026-03-24,3.0,2026.0,False,3,2026-03,long
github,7vwbds3snh28,Disruption with some GitHub services,minor,2026-03-22 09:08:38.800000+00:00,2026-03-22 10:02:05.683000+00:00,53.4,3,0,[],https://stspg.io/l939pt92g9sj,We are investigating reports of impacted performance for some GitHub services.,9.0,Sunday,2026-03-22,3.0,2026.0,False,3,2026-03,short
github,9jyjvxkz735j,Disruption with Copilot Coding Agent Sessions,major,2026-03-20 00:58:34.226000+00:00,2026-03-20 01:58:40.445000+00:00,60.1,4,0,[],https://stspg.io/5vnmx2tddlg2,We are investigating reports of impacted performance for some GitHub services.,0.0,Friday,2026-03-20,3.0,2026.0,False,3,2026-03,long
github,p08cncy05m4k,Git operations for users in the west coast are experiencing an increase in latency,minor,2026-03-19 16:25:04.692000+00:00,2026-03-20 00:05:15.572000+00:00,460.2,9,1,['Git Operations'],https://stspg.io/skszmdcydgwg,We are investigating reports of degraded performance for Git Operations,16.0,Thursday,2026-03-19,3.0,2026.0,False,2,2026-03,long
github,3gflh59mjhmf,Issues with Copilot Coding Agent,major,2026-03-19 13:44:15.731000+00:00,2026-03-19 14:32:55.748000+00:00,48.7,5,1,['Copilot'],https://stspg.io/2wv8jbdygp2k,We are investigating reports of impacted performance for some GitHub services.,13.0,Thursday,2026-03-19,3.0,2026.0,False,5,2026-03,short
github,djmkyscrj9jh,Disruption with Copilot Coding Agent sessions,minor,2026-03-19 02:05:59.173000+00:00,2026-03-19 02:52:44.246000+00:00,46.8,4,0,[],https://stspg.io/qkddxwg74ymy,We are investigating reports of impacted performance for some GitHub services.,2.0,Thursday,2026-03-19,3.0,2026.0,False,4,2026-03,short
github,49xnkj77r7vl,Disruption with some GitHub services,minor,2026-03-18 22:36:15.348000+00:00,2026-03-19 01:44:01.056000+00:00,187.8,8,1,['Git Operations'],https://stspg.io/g773dw43b88l,We are investigating reports of impacted performance for some GitHub services.,22.0,Wednesday,2026-03-18,3.0,2026.0,False,4,2026-03,long
github,x1g78jx4sgfk,Webhook delivery is delayed,minor,2026-03-18 18:51:00.633000+00:00,2026-03-18 19:46:38.809000+00:00,55.6,3,1,['Webhooks'],https://stspg.io/nq4nvbzkzfw3,We are investigating reports of degraded performance for Webhooks,18.0,Wednesday,2026-03-18,3.0,2026.0,False,3,2026-03,short
github,2lh36qcrd7l6,Errors starting and connecting to Codespaces,minor,2026-03-16 15:01:06.899000+00:00,2026-03-16 15:28:22.484000+00:00,27.3,4,0,[],https://stspg.io/5vpcvvyp7jdt,We are investigating reports of impacted performance for some GitHub services.,15.0,Monday,2026-03-16,3.0,2026.0,False,4,2026-03,short
github,xsxcyn25nfmq,Degraded performance for various services,minor,2026-03-13 15:12:48.287000+00:00,2026-03-13 16:15:33.784000+00:00,62.8,6,3,"['Issues', 'Actions', 'Packages']",https://stspg.io/xrr4ln3tbt88,We are investigating reports of degraded performance for Actions and Issues,15.0,Friday,2026-03-13,3.0,2026.0,False,5,2026-03,long
github,0s7ppykbyvqz,Degraded Codespaces experience,minor,2026-03-12 13:06:54.989000+00:00,2026-03-12 18:53:33.481000+00:00,346.6,9,1,['Codespaces'],https://stspg.io/lq4q8bqfnkqn,We are investigating reports of degraded performance for Codespaces,13.0,Thursday,2026-03-12,3.0,2026.0,False,3,2026-03,long
github,02z04m335tvv,Actions failures to download (401 Unauthorized),minor,2026-03-12 04:46:20.069000+00:00,2026-03-12 06:02:07.228000+00:00,75.8,4,1,['Actions'],https://stspg.io/8t1nfjvmmtqj,We are investigating reports of degraded performance for Actions,4.0,Thursday,2026-03-12,3.0,2026.0,False,2,2026-03,long
github,lw6j95nyw3py,Disruption with some GitHub services,minor,2026-03-12 01:54:18.324000+00:00,2026-03-12 02:45:55.801000+00:00,51.6,4,0,[],https://stspg.io/tg49qcr0n1lc,We are investigating reports of impacted performance for some GitHub services.,1.0,Thursday,2026-03-12,3.0,2026.0,False,4,2026-03,short
github,78s4l7y4tn2v,Degraded experience with Copilot Code Review,minor,2026-03-11 14:25:17.532000+00:00,2026-03-11 15:53:15.796000+00:00,88.0,5,0,[],https://stspg.io/twfx8xg9nf33,We are investigating reports of impacted performance for some GitHub services.,14.0,Wednesday,2026-03-11,3.0,2026.0,False,2,2026-03,long
github,zy1gjfc6x2z9,Incident with API Requests,minor,2026-03-11 14:37:31.222000+00:00,2026-03-11 15:02:23.694000+00:00,24.9,3,1,['API Requests'],https://stspg.io/vg3jh54ynrp5,We are investigating reports of degraded performance for API Requests,14.0,Wednesday,2026-03-11,3.0,2026.0,False,3,2026-03,short
github,8jx0t5c136x2,Incident With Webhooks,none,2026-03-10 15:00:00+00:00,2026-03-10 23:00:00+00:00,480.0,1,0,[],https://stspg.io/9dy0pjrt1hwh,"On March 10, 2026, between 23:00 UTC and 23:40 UTC, the Webhooks service was degraded and ~6% of users experienced intermittent errors when accessing webhook delivery history, retrying webhook deliver",15.0,Tuesday,2026-03-10,3.0,2026.0,False,0,2026-03,long
github,7k92rcz4f1zq,Incident with Webhooks,minor,2026-03-09 15:50:24.508000+00:00,2026-03-09 17:03:40.901000+00:00,73.3,4,1,['Webhooks'],https://stspg.io/pqgzxr03wx63,We are investigating reports of degraded performance for Webhooks,15.0,Monday,2026-03-09,3.0,2026.0,False,2,2026-03,long
github,tp8m3544w2g8,Incident with Codespaces,minor,2026-03-09 03:04:04.091000+00:00,2026-03-09 03:51:42.260000+00:00,47.6,5,1,['Codespaces'],https://stspg.io/tvxhncnsvhlt,We are investigating reports of degraded performance for Codespaces,3.0,Monday,2026-03-09,3.0,2026.0,False,5,2026-03,short
github,tqyg889tl8qz,Incident with Webhooks,minor,2026-03-06 16:58:10.899000+00:00,2026-03-06 23:28:13.610000+00:00,390.0,14,1,['Webhooks'],https://stspg.io/0ghhcmrrl5rn,We are investigating reports of degraded performance for Webhooks,16.0,Friday,2026-03-06,3.0,2026.0,False,4,2026-03,long
github,g9j4tmfqdd09,Actions is experiencing degraded availability,major,2026-03-05 22:53:42.829000+00:00,2026-03-05 23:55:20.066000+00:00,61.6,7,1,['Actions'],https://stspg.io/293glf6p6rh8,We are investigating reports of degraded performance for Actions,22.0,Thursday,2026-03-05,3.0,2026.0,False,6,2026-03,long
github,g5gnt5l5hf56,"Multiple services are affected, service degradation",major,2026-03-05 16:35:32.421000+00:00,2026-03-05 19:30:54.893000+00:00,175.4,11,2,"['Webhooks', 'Actions']",https://stspg.io/7b52c82jrq42,We are investigating reports of degraded performance for Actions,16.0,Thursday,2026-03-05,3.0,2026.0,False,5,2026-03,long
github,nlmpksjb2ll7,Disruption with some GitHub services,minor,2026-03-05 01:13:44.623000+00:00,2026-03-05 01:30:37.676000+00:00,16.9,4,0,[],https://stspg.io/mmwhwllsbr9b,We are investigating reports of impacted performance for some GitHub services.,1.0,Thursday,2026-03-05,3.0,2026.0,False,4,2026-03,short
github,t2p9yhsww5lc,Some OpenAI models degraded in Copilot,minor,2026-03-05 00:47:42.323000+00:00,2026-03-05 01:13:31.659000+00:00,25.8,4,1,['Copilot'],https://stspg.io/ynz3ctryhr3g,We are investigating reports of degraded performance for Copilot,0.0,Thursday,2026-03-05,3.0,2026.0,False,4,2026-03,short
github,nglcmhr2kfb0,Claude Opus 4.6 Fast not appearing for some Copilot users,minor,2026-03-03 20:31:39.439000+00:00,2026-03-03 21:11:30.921000+00:00,39.9,3,1,['Copilot'],https://stspg.io/lktk63ssmfwx,We are investigating reports of degraded performance for Copilot,20.0,Tuesday,2026-03-03,3.0,2026.0,False,3,2026-03,short
github,n07yy1bk6kc4,Incident with all GitHub services,major,2026-03-03 18:59:49.439000+00:00,2026-03-03 20:09:16.863000+00:00,69.5,25,8,"['Git Operations', 'Webhooks', 'API Requests', 'Issues', 'Pull Requests', 'Actions', 'Codespaces', 'Copilot']",https://stspg.io/9dmdz253g6n1,"We are investigating reports of degraded availability for Actions, Copilot and Issues",18.0,Tuesday,2026-03-03,3.0,2026.0,False,23,2026-03,long
github,0yjbtp1d2cpc,Delayed visibility of newly added issues on project boards,minor,2026-03-02 23:10:28.140000+00:00,2026-03-03 05:54:17.975000+00:00,403.8,13,1,['Issues'],https://stspg.io/9ynj2pcf723l,We are investigating reports of impacted performance for some GitHub services.,23.0,Monday,2026-03-02,3.0,2026.0,False,5,2026-03,long
github,vhpmx9vc93m0,Incident with Pull Requests /pulls,minor,2026-03-02 19:11:22.749000+00:00,2026-03-02 22:04:27.487000+00:00,173.1,6,1,['Pull Requests'],https://stspg.io/z2ppmbl0njn0,We are investigating reports of degraded performance for Pull Requests,19.0,Monday,2026-03-02,3.0,2026.0,False,3,2026-03,long
github,kw5jh58jh24k,Incident with Copilot agent sessions,minor,2026-02-27 23:18:12.408000+00:00,2026-02-27 23:49:05.426000+00:00,30.9,5,1,['Copilot'],https://stspg.io/k350x50r7bt4,We are investigating reports of degraded performance for Copilot,23.0,Friday,2026-02-27,2.0,2026.0,False,5,2026-02,short
github,kv1lzpgzr9yp,Code view fails to load when content contains some non-ASCII characters,minor,2026-02-27 03:08:23.495000+00:00,2026-02-27 06:04:02.145000+00:00,175.6,6,0,[],https://stspg.io/5zqmjwwn4z1q,We are investigating reports of impacted performance for some GitHub services.,3.0,Friday,2026-02-27,2.0,2026.0,False,2,2026-02,long
github,vd3xqfq36rgm,High latency on webhook API requests,minor,2026-02-27 00:01:45.135000+00:00,2026-02-27 00:04:01.026000+00:00,2.3,3,1,['Webhooks'],https://stspg.io/p4xckctzj9s4,We are investigating reports of impacted performance for some GitHub services.,0.0,Friday,2026-02-27,2.0,2026.0,False,3,2026-02,short
github,f6d6nm7gn304,Incident with Copilot,minor,2026-02-26 10:22:00.435000+00:00,2026-02-26 11:06:32.566000+00:00,44.5,3,1,['Copilot'],https://stspg.io/3nyv61b5k0g6,We are investigating reports of degraded performance for Copilot,10.0,Thursday,2026-02-26,2.0,2026.0,False,3,2026-02,short
github,l1bt9psnsqpg,Incident with Copilot Agent Sessions impacting CCA/CCR,minor,2026-02-25 16:38:11.353000+00:00,2026-02-25 16:44:50.040000+00:00,6.6,2,1,['Copilot'],https://stspg.io/hzmqt1dbcjn1,We are investigating reports of degraded performance for Copilot,16.0,Wednesday,2026-02-25,2.0,2026.0,False,2,2026-02,short
github,jn8kcmg5ydch,Code search experiencing degraded performance,minor,2026-02-23 19:59:55.629000+00:00,2026-02-24 00:46:29.447000+00:00,286.6,7,0,[],https://stspg.io/vlsdcsk5grvk,We are investigating reports of impacted performance for some GitHub services.,19.0,Monday,2026-02-23,2.0,2026.0,False,2,2026-02,long
github,47n199g2d88x,Incident with Issues and Pull Requests Search,minor,2026-02-23 21:16:49.661000+00:00,2026-02-23 21:30:42.275000+00:00,13.9,3,2,"['Issues', 'Pull Requests']",https://stspg.io/8d9nr8gqgh9d,We are investigating reports of degraded performance for Issues and Pull Requests,21.0,Monday,2026-02-23,2.0,2026.0,False,3,2026-02,short
github,59rjsk76t3rf,Incident with Actions,minor,2026-02-23 16:17:35.130000+00:00,2026-02-23 17:03:56.515000+00:00,46.4,2,1,['Actions'],https://stspg.io/c10wfx1zgs7j,We are investigating reports of degraded performance for Actions,16.0,Monday,2026-02-23,2.0,2026.0,False,2,2026-02,short
github,h8z3w9ycj0pm,Incident with Copilot,minor,2026-02-23 14:56:09.362000+00:00,2026-02-23 16:19:33.814000+00:00,83.4,6,1,['Copilot'],https://stspg.io/crkynbn1mbtt,We are investigating reports of degraded performance for Copilot,14.0,Monday,2026-02-23,2.0,2026.0,False,3,2026-02,long
github,zhfdlzldgh51,Extended job start delays for larger hosted runners,minor,2026-02-20 20:00:07.517000+00:00,2026-02-20 20:41:24.099000+00:00,41.3,4,0,[],https://stspg.io/6h5h3c6mf6sl,We are investigating reports of impacted performance for some GitHub services.,20.0,Friday,2026-02-20,2.0,2026.0,False,4,2026-02,short
github,8qvx6hqk3nz0,Incident with Copilot GPT-5.1-Codex,minor,2026-02-20 10:02:19.243000+00:00,2026-02-20 11:41:39.490000+00:00,99.3,5,1,['Copilot'],https://stspg.io/z5nxbm5x340d,We are investigating reports of degraded performance for Copilot,10.0,Friday,2026-02-20,2.0,2026.0,False,3,2026-02,long
github,p1ymhg64hdfq,Degraded performance in merge queue,minor,2026-02-18 18:25:38.234000+00:00,2026-02-18 19:20:16.866000+00:00,54.6,5,1,['Pull Requests'],https://stspg.io/kv62hwwldqd6,We are investigating reports of impacted performance for some GitHub services.,18.0,Wednesday,2026-02-18,2.0,2026.0,False,5,2026-02,short
github,xs6xtcv196g7,Intermittent authentication failures on GitHub,minor,2026-02-17 17:46:12.862000+00:00,2026-02-17 19:06:24.554000+00:00,80.2,5,2,"['Git Operations', 'Actions']",https://stspg.io/l0t7nq7qn326,We are investigating reports of degraded performance for Actions and Git Operations,17.0,Tuesday,2026-02-17,2.0,2026.0,False,3,2026-02,long
github,lvf95rlzkxrr,Disruption with some GitHub services regarding file upload,minor,2026-02-13 22:30:40.866000+00:00,2026-02-13 22:58:42.408000+00:00,28.0,2,0,[],https://stspg.io/jvmppzz4hmll,We are investigating reports of impacted performance for some GitHub services.,22.0,Friday,2026-02-13,2.0,2026.0,False,2,2026-02,short
github,y7kzv1ps2qrm,Disruption with some GitHub services,minor,2026-02-12 18:36:09.682000+00:00,2026-02-12 20:34:55.640000+00:00,118.8,5,0,[],https://stspg.io/1dxq88cbf063,We are investigating reports of impacted performance for some GitHub services.,18.0,Thursday,2026-02-12,2.0,2026.0,False,3,2026-02,long
github,1x0f4x1wwqmb,Intermittent disruption with Copilot completions and inline suggestions,minor,2026-02-12 14:06:48.924000+00:00,2026-02-12 16:50:01.738000+00:00,163.2,4,0,[],https://stspg.io/yxnj1jc92qr6,We are investigating reports of impacted performance for some GitHub services.,14.0,Thursday,2026-02-12,2.0,2026.0,False,2,2026-02,long
github,5txsjlt9299p,Disruption with some GitHub services,major,2026-02-12 10:38:35.077000+00:00,2026-02-12 11:12:16.022000+00:00,33.7,4,0,[],https://stspg.io/plkvv7xkwrm4,We are investigating reports of impacted performance for some GitHub services.,10.0,Thursday,2026-02-12,2.0,2026.0,False,4,2026-02,short
github,7m8kxmjq0y7m,Incident with Codespaces,major,2026-02-12 07:53:58.038000+00:00,2026-02-12 09:56:06.097000+00:00,122.1,8,1,['Codespaces'],https://stspg.io/0fdc3bbq1qx0,We are investigating reports of degraded availability for Codespaces,7.0,Thursday,2026-02-12,2.0,2026.0,False,3,2026-02,long
github,7ylfn6fnwgrq,Disruption with some GitHub services,minor,2026-02-11 18:58:10.101000+00:00,2026-02-12 00:59:23.073000+00:00,361.2,5,0,[],https://stspg.io/0lr3l9p5bggb,We are investigating reports of impacted performance for some GitHub services.,18.0,Wednesday,2026-02-11,2.0,2026.0,False,3,2026-02,long
github,frlwqbqgz113,Incident with API Requests,minor,2026-02-11 15:26:53.487000+00:00,2026-02-11 17:15:03.823000+00:00,108.2,6,1,['API Requests'],https://stspg.io/205xtprvt8vw,We are investigating reports of degraded performance for API Requests,15.0,Wednesday,2026-02-11,2.0,2026.0,False,3,2026-02,long
github,531k65vmv284,Incident with Copilot,minor,2026-02-11 15:26:49.303000+00:00,2026-02-11 15:46:40.416000+00:00,19.9,5,1,['Copilot'],https://stspg.io/0yj91sbr5qtp,We are investigating reports of degraded performance for Copilot,15.0,Wednesday,2026-02-11,2.0,2026.0,False,5,2026-02,short
github,wkgqj4546z1c,Disruption with some GitHub services,minor,2026-02-10 15:07:05.484000+00:00,2026-02-10 15:58:49.895000+00:00,51.7,8,1,['Pull Requests'],https://stspg.io/16q4k5y5b8m9,We are investigating reports of impacted performance for some GitHub services.,15.0,Tuesday,2026-02-10,2.0,2026.0,False,8,2026-02,short
github,t5qmhtg29933,Copilot Policy Propagation Delays,minor,2026-02-09 16:29:41.378000+00:00,2026-02-10 09:57:57.385000+00:00,1048.3,10,1,['Copilot'],https://stspg.io/485py7lrgkjt,We are investigating reports of degraded performance for Copilot,16.0,Monday,2026-02-09,2.0,2026.0,True,3,2026-02,long
github,lcw3tg2f6zsd,"Incident with Issues, Actions and Git Operations",major,2026-02-09 19:01:33.060000+00:00,2026-02-09 20:09:32+00:00,68.0,13,8,"['Git Operations', 'Webhooks', 'Issues', 'Pull Requests', 'Actions', 'Packages', 'Pages', 'Codespaces']",https://stspg.io/k16wk8tbvdvk,"We are investigating reports of degraded performance for Actions, Git Operations and Issues",19.0,Monday,2026-02-09,2.0,2026.0,False,10,2026-02,long
github,54hndjxft5bx,Notifications are delayed,minor,2026-02-09 15:54:52.823000+00:00,2026-02-09 19:29:45.715000+00:00,214.9,8,0,[],https://stspg.io/4k2cyb4hg0nk,We are investigating reports of impacted performance for some GitHub services.,15.0,Monday,2026-02-09,2.0,2026.0,False,3,2026-02,long
github,smf24rvl67v9,Incident with Pull Requests,major,2026-02-09 16:19:22.233000+00:00,2026-02-09 17:40:57+00:00,81.6,17,6,"['Git Operations', 'Webhooks', 'Issues', 'Pull Requests', 'Actions', 'Pages']",https://stspg.io/0bh72947r0m2,We are investigating reports of degraded performance for Pull Requests,16.0,Monday,2026-02-09,2.0,2026.0,False,9,2026-02,long
github,tkz0ptx49rl0,Incident with Actions,minor,2026-02-09 14:17:02.051000+00:00,2026-02-09 15:46:39.997000+00:00,89.6,7,1,['Actions'],https://stspg.io/smhn681gk34y,We are investigating reports of degraded performance for Actions,14.0,Monday,2026-02-09,2.0,2026.0,False,3,2026-02,long
github,qrlc0jjgw517,Degraded performance for Copilot Coding Agent,minor,2026-02-09 10:01:18.057000+00:00,2026-02-09 12:12:22.991000+00:00,131.1,4,0,[],https://stspg.io/dx8zycd3v68n,We are investigating reports of impacted performance for some GitHub services.,10.0,Monday,2026-02-09,2.0,2026.0,False,2,2026-02,long
github,ffz2k716tlhx,"Degraded Performance in Webhooks API and UI, Pull Requests",minor,2026-02-09 08:15:33.042000+00:00,2026-02-09 11:26:33.525000+00:00,191.0,16,5,"['Git Operations', 'Webhooks', 'Issues', 'Pull Requests', 'Actions']",https://stspg.io/2xnh8znb33vr,We are investigating reports of degraded performance for Pull Requests and Webhooks,8.0,Monday,2026-02-09,2.0,2026.0,False,4,2026-02,long
github,41mrvyqnmnmb,Incident with Pull Requests,minor,2026-02-06 17:49:13.673000+00:00,2026-02-06 18:36:53.129000+00:00,47.7,5,1,['Pull Requests'],https://stspg.io/gbsf5yc8tggt,We are investigating reports of degraded performance for Pull Requests,17.0,Friday,2026-02-06,2.0,2026.0,False,5,2026-02,short
github,y7www8s68myy,Incident with Copilot,minor,2026-02-06 11:16:01.442000+00:00,2026-02-06 11:58:04.219000+00:00,42.0,5,1,['Copilot'],https://stspg.io/qd0dsh7gzy28,We are investigating reports of degraded performance for Copilot,11.0,Friday,2026-02-06,2.0,2026.0,False,5,2026-02,short
github,f314nlctbfs5,Delays in UI updates for Actions Runs,minor,2026-02-03 16:10:32.394000+00:00,2026-02-03 19:28:45.236000+00:00,198.2,4,1,['Actions'],https://stspg.io/xv1lt3mclwk1,We are investigating reports of degraded performance for Actions,16.0,Tuesday,2026-02-03,2.0,2026.0,False,2,2026-02,long
github,zr4jt8bj1mg2,Incident with Copilot,minor,2026-02-03 10:16:24.452000+00:00,2026-02-03 10:56:28.680000+00:00,40.1,4,1,['Copilot'],https://stspg.io/m25fmcqywypn,We are investigating reports of degraded performance for Copilot,10.0,Tuesday,2026-02-03,2.0,2026.0,False,4,2026-02,short
github,xwn6hjps36ty,Incident with Actions,major,2026-02-02 19:03:14.218000+00:00,2026-02-03 00:56:04.931000+00:00,352.8,16,3,"['Actions', 'Pages', 'Copilot']",https://stspg.io/q03plj7gcr4d,We are investigating reports of degraded performance for Actions,19.0,Monday,2026-02-02,2.0,2026.0,False,5,2026-02,long
github,t4s6xgbwv60j,Incident with Codespaces,major,2026-02-02 20:17:19.554000+00:00,2026-02-03 00:54:54.466000+00:00,277.6,6,1,['Codespaces'],https://stspg.io/flvngz4l79b5,We are investigating reports of degraded availability for Codespaces,20.0,Monday,2026-02-02,2.0,2026.0,False,2,2026-02,long
github,g9mdtzd4rt72,Disruption with some GitHub services,major,2026-02-02 17:41:19.364000+00:00,2026-02-02 18:46:39.763000+00:00,65.3,3,0,[],https://stspg.io/59wknsgq8ztj,We are investigating reports of impacted performance for some GitHub services.,17.0,Monday,2026-02-02,2.0,2026.0,False,2,2026-02,long
github,vj8q32xs2d32,Disruption with some GitHub services,minor,2026-02-02 17:34:25.662000+00:00,2026-02-02 17:43:51.890000+00:00,9.4,4,1,['Git Operations'],https://stspg.io/8qrclpjz56xp,We are investigating reports of impacted performance for some GitHub services.,17.0,Monday,2026-02-02,2.0,2026.0,False,4,2026-02,short
github,szwg1z6zjsvx,Degraded Experience - Failing to finalize some CCA Jobs,minor,2026-01-30 20:59:51.229000+00:00,2026-01-30 21:22:23.126000+00:00,22.5,3,1,['Actions'],https://stspg.io/1rjxl8y9pg47,We are investigating reports of degraded performance for Actions,20.0,Friday,2026-01-30,1.0,2026.0,False,3,2026-01,short
github,22zx8fw9qt4t,Actions Workflows Run Start Delays,minor,2026-01-28 15:12:41.886000+00:00,2026-01-28 15:54:04.612000+00:00,41.4,3,1,['Actions'],https://stspg.io/nwn2qh7hrr1y,We are investigating reports of degraded performance for Actions,15.0,Wednesday,2026-01-28,1.0,2026.0,False,3,2026-01,short
github,90hj03y5tj3c,Regression in windows runners for public repositories,minor,2026-01-26 19:25:51.846000+00:00,2026-01-26 23:51:44.475000+00:00,265.9,8,0,[],https://stspg.io/549qtmw22lzj,We are investigating reports of impacted performance for some GitHub services.,19.0,Monday,2026-01-26,1.0,2026.0,False,3,2026-01,long
github,g697qcy5dsks,Disruption with repo creation,minor,2026-01-25 02:43:41.188000+00:00,2026-01-25 03:08:33.169000+00:00,24.9,4,0,[],https://stspg.io/wtch7mprmscv,We are investigating reports of impacted performance for some GitHub services.,2.0,Sunday,2026-01-25,1.0,2026.0,False,4,2026-01,short
github,cqb5hcy0gx18,Disruption with some GitHub services,minor,2026-01-22 14:12:49.865000+00:00,2026-01-22 15:22:59.780000+00:00,70.2,5,1,['Issues'],https://stspg.io/1vqlgvn4h35h,We are investigating reports of impacted performance for some GitHub services.,14.0,Thursday,2026-01-22,1.0,2026.0,False,3,2026-01,long
github,6d5kv6l8d8q3,Policy pages for Copilot are timing out,minor,2026-01-21 19:31:05.378000+00:00,2026-01-21 20:53:06.598000+00:00,82.0,5,0,[],https://stspg.io/p2sbjf6lb6q9,We are investigating reports of impacted performance for some GitHub services.,19.0,Wednesday,2026-01-21,1.0,2026.0,False,3,2026-01,long
github,qq1gg4klp5vm,Copilot Chat - Grok Code Fast 1 Outage,minor,2026-01-21 11:33:50.291000+00:00,2026-01-21 12:38:59.386000+00:00,65.2,3,1,['Copilot'],https://stspg.io/dtwnvw54g019,We are investigating reports of degraded performance for Copilot,11.0,Wednesday,2026-01-21,1.0,2026.0,False,2,2026-01,long
github,fw294tth5m8y,Run start delays in Actions,minor,2026-01-20 19:49:39.626000+00:00,2026-01-20 20:10:54.079000+00:00,21.2,3,1,['Actions'],https://stspg.io/b72glxypdjl5,We are investigating reports of degraded performance for Actions,19.0,Tuesday,2026-01-20,1.0,2026.0,False,3,2026-01,short
github,m4xfyzd8mn2n,Incident affecting actions-runner-controller,minor,2026-01-20 16:02:58.483000+00:00,2026-01-20 16:23:09.238000+00:00,20.2,3,1,['Actions'],https://stspg.io/qv5215sqksl7,We are investigating reports of degraded performance for Actions,16.0,Tuesday,2026-01-20,1.0,2026.0,False,3,2026-01,short
