service,id,name,impact,created_at,resolved_at,duration_minutes,num_updates,num_components,components,shortlink,first_update,created_hour,created_weekday,created_date,created_month,created_year,is_outlier,first_hour_updates,year_month,duration_class
datadog,9cnzff9q1hjp,Degraded Web Application Performance & Monitor Evaluations,none,2025-07-09 20:46:31.893000+00:00,2025-07-09 21:46:32.507000+00:00,60.0,4,3,"['Cloud Cost Management', 'Monitors', 'Web Application']",https://stspg.io/qb0h511grvbk,"We're investigating an issue with our metrics and monitor evaluations, causing degraded web application performance and skipped monitors",16.0,Wednesday,2025-07-09,7.0,2025.0,False,3,2025-07,long
datadog,d6d8qmycwvhs,Monitors - Delayed Evaluation of logs monitors,major,2025-07-07 14:39:09.258000+00:00,2025-07-07 17:07:57.629000+00:00,148.8,3,1,['Monitors'],https://stspg.io/118gb2gm7d4m,"We are investigating delays in Monitors Evaluation of logs based monitors., which began at 01:30:00 PM UTC.",10.0,Monday,2025-07-07,7.0,2025.0,False,2,2025-07,long
datadog,pswlvh1f1z0x,Logs Monitors - Delayed Evaluations,major,2025-06-24 21:16:51.478000+00:00,2025-06-24 21:48:33.631000+00:00,31.7,3,1,['Monitors'],https://stspg.io/v4rtrbbdlft9,"We are investigating delays in Logs Monitors Evaluations, which began at 8:46 PM UTC.",17.0,Tuesday,2025-06-24,6.0,2025.0,False,3,2025-06,short
datadog,cl8kndpnv8hw,Delayed processing of APM Trace Metrics,major,2025-06-09 22:47:25.494000+00:00,2025-06-10 00:06:26.403000+00:00,79.0,4,3,"['APM', 'Monitors', 'Web Application']",https://stspg.io/ykvdh0gyzx9p,"We are investigating delayed processing of APM Trace metrics starting around 21:40 UTC.  

Dashboards and monitors relying on these metrics are affected.",18.0,Monday,2025-06-09,6.0,2025.0,False,3,2025-06,long
datadog,mql64yfc7nf6,Elevated error rates in queries across multiple products,major,2025-06-05 15:08:20.360000+00:00,2025-06-05 15:46:20.922000+00:00,38.0,4,4,"['Audit Trail', 'Log Management', 'RUM', 'Synthetics']",https://stspg.io/fvgq9vndzff4,"We are actively investigating issues querying data affecting multiple products. As a result of this issue, there might be errors when trying to load data from queries on different pages of the web app",11.0,Thursday,2025-06-05,6.0,2025.0,False,4,2025-06,short
datadog,7fmx45blzwkc,Monitors - Delayed Evaluation,minor,2025-05-22 17:46:29+00:00,2025-05-22 19:09:06.851000+00:00,82.6,3,1,['Monitors'],https://stspg.io/sgpmztmgb5xq,"We are investigating delays in Distribution Monitors Evaluation, which began at 5:30pm UTC. Monitors for other types of metrics are evaluating as usual.",13.0,Thursday,2025-05-22,5.0,2025.0,False,2,2025-05,long
datadog,mb4f0fpm1nym,Delayed Traces and Spans in APM,minor,2025-05-13 19:06:02+00:00,2025-05-13 22:28:28.493000+00:00,202.4,5,2,"['APM', 'Monitors']",https://stspg.io/gb734zp5v7z4,"We are investigating increased latency processing Traces and Spans in APM
As a result of this issue, some users may see missing or delayed traces and Spans starting at 18:33 UTC.",15.0,Tuesday,2025-05-13,5.0,2025.0,False,3,2025-05,long
datadog,r0rpr0wd9ydc,Delayed AWS Metrics and Events,major,2025-05-02 00:56:58.149000+00:00,2025-05-02 02:13:02.351000+00:00,76.1,4,1,['Metrics and Infra Monitoring'],https://stspg.io/bq57sxs50k13,"We are investigating increased latency processing AWS metrics and events.
As a result of this issue, some users may see delays or gaps in graphs that contain these metrics and events.
To prevent spuri",20.0,Thursday,2025-05-01,5.0,2025.0,False,3,2025-05,long
datadog,6df1kpz36y8g,Monitors - Delayed Evaluation,minor,2025-04-16 13:37:46.093000+00:00,2025-04-16 13:52:55.646000+00:00,15.2,3,1,['Monitors'],https://stspg.io/krslby1ljyj0,"We are investigating delays in Monitors Evaluation, which began at 12:45 UTC.",9.0,Wednesday,2025-04-16,4.0,2025.0,False,3,2025-04,short
datadog,gvdjyvjjwn3q,Delayed processing of APM Trace Metrics,minor,2025-03-26 20:03:20.918000+00:00,2025-03-26 20:24:56.172000+00:00,21.6,5,3,"['APM', 'Monitors', 'Web Application']",https://stspg.io/6qjf6824v1k3,"We are investigating delayed processing of APM Trace metrics starting around 07:00 UTC.  

Dashboards and monitors relying on these metrics are affected.",16.0,Wednesday,2025-03-26,3.0,2025.0,False,5,2025-03,short
datadog,dx530cw2nkr8,Login Issues,minor,2025-03-25 19:03:39.998000+00:00,2025-03-26 00:17:35.788000+00:00,313.9,4,1,['Web Application'],https://stspg.io/g7vbrw09s8j8,"We are investigating user login issues related to reCAPTCHA for customers using password login.  If you experience an issue with reCAPTCHA, refreshing the page can often mitigate the issue. 

Please n",15.0,Tuesday,2025-03-25,3.0,2025.0,False,2,2025-03,long
datadog,ltjfhpm7bj3q,Delayed Processing for a Subset of Metrics,minor,2025-02-23 09:30:54.065000+00:00,2025-02-23 15:32:17.343000+00:00,361.4,7,1,['Metrics and Infra Monitoring'],https://stspg.io/my0sx3mpz0n4,"We are investigating increased latency processing Trace Metrics.
As a result of this issue, some users may see delays or gaps for a subset of their metrics on graphs and statistics on Service Catalog.",4.0,Sunday,2025-02-23,2.0,2025.0,False,2,2025-02,long
digitalocean,wjyr2cz6y3xb,Droplet Availability in All Regions,none,2026-04-10 20:32:35.032000+00:00,2026-04-10 21:06:25.601000+00:00,33.8,2,4,"['API', 'Global', 'Global', 'Cloud Control Panel']",https://stspg.io/nm9g257py11j,"Subject: Droplet Availability in All Regions

Our Engineering team has identifed an issue with Droplet creates in all regions. A root cause has been found, a fix has been put in place and we are curre",20.0,Friday,2026-04-10,4.0,2026.0,False,2,2026-04,short
digitalocean,3kr7638lkhy9,Control Plane,none,2026-04-07 17:49:19.482000+00:00,2026-04-07 17:49:19.537000+00:00,0.0,1,2,"['API', 'Cloud Control Panel']",https://stspg.io/95hk5rhl18dv,"Our Engineering team has resolved the control plane disruption that occurred from 17:06 to 17:18 UTC. During this time, users may have experienced intermittent issues with managing their resources thr",17.0,Tuesday,2026-04-07,4.0,2026.0,False,1,2026-04,short
digitalocean,bx60kdvsvtvb,Serverless Inference - High error rates for open source models ( Qwen 3 32B),minor,2026-04-07 12:49:27.325000+00:00,2026-04-07 15:50:48.300000+00:00,181.3,3,1,['Gradient AI'],https://stspg.io/k6d360ll8gbm,Serverless inference for alibaba-qwen3-32b (Qwen 3 32B) in tor1 is experiencing high error rates starting at 10:46 UTC.,12.0,Tuesday,2026-04-07,4.0,2026.0,False,2,2026-04,long
digitalocean,grhp94sd84gd,Serverless Inference Issue,minor,2026-04-06 12:28:01.026000+00:00,2026-04-06 18:02:37.450000+00:00,334.6,3,1,['Gradient AI'],https://stspg.io/l42s2qz6hz2m,"Our Engineering team is investigating an issue with Serverless inference.

At this time, users may experience high error rates for open source models (llama 3.3 70b).

We apologize for the inconvenien",12.0,Monday,2026-04-06,4.0,2026.0,False,1,2026-04,long
digitalocean,p3ybkddb3wmm,Gradient AI Platform agents and services Accessibility,major,2026-03-20 08:50:11.185000+00:00,2026-03-20 14:14:29.007000+00:00,324.3,5,1,['Gradient AI'],https://stspg.io/4g49pq97jlvn,We are currently investigating issue affecting the accessibility of agents and services on the Gradient AI Platform. Users may experience failures or unresponsiveness when attempting to use these feat,8.0,Friday,2026-03-20,3.0,2026.0,False,1,2026-03,long
digitalocean,lg35bbsgn1cp,App platform seeing delays in deployments across FRA1 region,minor,2026-03-20 10:32:50.954000+00:00,2026-03-20 12:01:24.265000+00:00,88.6,3,1,['Frankfurt'],https://stspg.io/8rq4jr333wqw,"Our engineers are currently investigating an issue impacting new App Platform deployments using Dedicated Egress IP in FRA1 region. During this time, some users may experience delay when creating new ",10.0,Friday,2026-03-20,3.0,2026.0,False,2,2026-03,long
digitalocean,bx2zgwbwgltm,Gradient AI model availability,minor,2026-03-17 15:00:37.215000+00:00,2026-03-17 19:49:27.605000+00:00,288.8,2,1,['Gradient AI'],https://stspg.io/thrrzdr0vm31,"Our Engineering team is investigating reports of Gradient AI model availability issues impacting multiple models. Users may experience issues with models availability, including Llama3.1-8b and Qwen3-",15.0,Tuesday,2026-03-17,3.0,2026.0,False,1,2026-03,long
digitalocean,pypzpnnc373w,Cloud Control Panel and API,none,2026-03-16 17:39:43.829000+00:00,2026-03-16 17:39:43.893000+00:00,0.0,1,2,"['API', 'Cloud Control Panel']",https://stspg.io/whzv0dcwtg2b,"From 16:14 to 16:38 UTC, Our Engineering team observed an issue impacting Cloud control panel and API. During this time, users may experienced errors when trying to access the Cloud control panel and ",17.0,Monday,2026-03-16,3.0,2026.0,False,1,2026-03,short
digitalocean,9pns1qlx6hqc,Degraded performance with BYOK Anthropic models,minor,2026-03-15 02:55:12.418000+00:00,2026-03-15 03:31:58.736000+00:00,36.8,2,1,['Gradient AI'],https://stspg.io/v93qqgrdwzjb,"Our Engineering team is investigating an issue related to all Gradient AI agents and serverless inference that require BYOK Anthropic modles.
Impacted users may experience degraded performance.
We wil",2.0,Sunday,2026-03-15,3.0,2026.0,False,2,2026-03,short
digitalocean,0bhc3myf4l0s,Delay in App Platform Deployments,minor,2026-03-13 21:30:19.813000+00:00,2026-03-14 01:47:40.346000+00:00,257.3,4,1,['Global'],https://stspg.io/h3f4kqpshs3c,"Starting at 20:40 UTC, users may have seen delays with deploying new apps on App Platform. 

At this time, our Engineering team is seeing signs of recovery, and users should be able to deploy new apps",21.0,Friday,2026-03-13,3.0,2026.0,False,2,2026-03,long
digitalocean,hl6fx4s2ydm1,Newly Created Managed Kubernetes Nodes,minor,2026-03-13 11:26:31.545000+00:00,2026-03-13 16:35:05.145000+00:00,308.6,4,1,['Global'],https://stspg.io/9lsmtzwwj3yb,"Our Engineering team is investigating an issue impacting newly provisioned Managed Kubernetes nodes. During this time, new nodes may experience DNS timeouts, which could temporarily affect cluster ser",11.0,Friday,2026-03-13,3.0,2026.0,False,1,2026-03,long
digitalocean,cqn6lrhjd3tr,Ubuntu/Debian Package Mirror Failure,none,2026-03-09 19:23:11.943000+00:00,2026-03-09 19:23:11.992000+00:00,0.0,1,1,['Global'],https://stspg.io/tn038zv25nk6,"From 17:50 to 19:06 UTC, Our Engineering team observed an issue with mirrors.digitalocean.com. During this time, users may have experienced errors when trying to update packages on Debian and Ubuntu I",19.0,Monday,2026-03-09,3.0,2026.0,False,1,2026-03,short
digitalocean,k0cd863c8105,HTTP 522 Error on App Platform,none,2026-03-06 21:22:49.978000+00:00,2026-03-06 21:22:50.041000+00:00,0.0,1,1,['Global'],https://stspg.io/kjsfg0vqjnth,"Our Engineering team identified an issue affecting the App Platform. During the incident, users may have experienced HTTP 522 (Connection Timed Out) errors when accessing their apps. The issue seems t",21.0,Friday,2026-03-06,3.0,2026.0,False,1,2026-03,short
digitalocean,8c4s46c9r7m9,App Platform Deployments,minor,2026-03-05 23:28:24.726000+00:00,2026-03-06 01:12:26.515000+00:00,104.0,3,1,['Global'],https://stspg.io/6k60d4pm3rky,"Our Engineering team is currently investigating an issue impacting App Platform deployments. During this time, users may experience a delay or failure when deploying new and existing App Platform apps",23.0,Thursday,2026-03-05,3.0,2026.0,False,1,2026-03,long
digitalocean,c7z5d74zrdhp,Internal Load Balancers Connectivity,minor,2026-03-05 00:23:30.936000+00:00,2026-03-05 01:52:23.806000+00:00,88.9,3,1,['Global'],https://stspg.io/x563tly1pmt3,"Our Engineering team is investigating an issue affecting Internal Load Balancers. Customers may experience connectivity loss between Internal Load Balancers and their associated target droplets.

We a",0.0,Thursday,2026-03-05,3.0,2026.0,False,2,2026-03,long
digitalocean,7pxx131dr1qt,App Platform Deployments,minor,2026-02-26 17:14:56.738000+00:00,2026-02-27 04:55:52.123000+00:00,700.9,2,1,['Global'],https://stspg.io/jn5x021ltzds,"As of 14:30 UTC, our Engineering team is investigating reports of build failures on App Platform for customers using older version of the Node.js buildpack. Users may experience errors when attempting",17.0,Thursday,2026-02-26,2.0,2026.0,True,1,2026-02,long
digitalocean,1xs8w0shdkh2,Intermittent Errors with Llama 3.3-70B,minor,2026-02-26 16:00:23+00:00,2026-02-26 22:23:32.306000+00:00,383.2,3,1,['Gradient AI'],https://stspg.io/x44385wfgfpk,"We are currently investigating an issue affecting the Llama 3.3-70B model.
Symptoms: Users may encounter intermittent errors when making serverless inference requests via APIs and Agents.
Current Stat",16.0,Thursday,2026-02-26,2.0,2026.0,False,0,2026-02,long
digitalocean,wcdry38l3ls5,Control Panel Visibility,minor,2026-02-19 17:34:37.206000+00:00,2026-02-19 18:42:16.710000+00:00,67.7,3,1,['Cloud Control Panel'],https://stspg.io/dhrnpr7qzn1k,"Our team is currently investigating an issue impacting the visibility of the Control Panel. Users may notice unexpected behavior, such as being prompted for login credentials when accessing the consol",17.0,Thursday,2026-02-19,2.0,2026.0,False,2,2026-02,long
digitalocean,l10ntywl5ssb,Spaces Availability in NYC3,none,2026-02-16 07:36:35.652000+00:00,2026-02-16 10:58:04.057000+00:00,201.5,2,2,"['NYC3', 'NYC3']",https://stspg.io/s4vz9z8hr3qr,"Between 5:34 and 6:32 UTC, our Engineering team identified the issue that was impacting the availability of Spaces and the Container Registry in the NYC3 region. A fix has been implemented to resolve ",7.0,Monday,2026-02-16,2.0,2026.0,False,1,2026-02,long
digitalocean,t8b645wwhm7m,Droplet Limit Increase Feature,none,2026-02-16 06:38:26.999000+00:00,2026-02-16 09:24:56.103000+00:00,166.5,3,0,[],https://stspg.io/dnq6b5cjzq0c,"Our Engineering team is currently investigating an issue affecting the Droplet limit increase feature within the Cloud Control Panel.

At this time requests to increase Droplet limits submitted throug",6.0,Monday,2026-02-16,2.0,2026.0,False,1,2026-02,long
digitalocean,wvx8hcnvynv0,Delay in App Platform Deployments,minor,2026-02-12 19:06:59.080000+00:00,2026-02-12 19:34:48.537000+00:00,27.8,3,1,['Global'],https://stspg.io/d3w34wqm0scp,"Our engineers are currently investigating an issue impacting new App Platform deployments. 

During this time, some users may experience delay when creating new App Platform apps. Existing apps are no",19.0,Thursday,2026-02-12,2.0,2026.0,False,3,2026-02,short
digitalocean,ftlzzqf5vswr,MongoDB Cluster Creation,minor,2026-02-12 05:42:16.648000+00:00,2026-02-12 12:06:41.776000+00:00,384.4,5,1,['Global'],https://stspg.io/mghbxr8rn8yg,"Our Engineering team is investigating an issue with all events for MongoDB clusters in all of our regions.

During this time, users may face issues with creation, fork and resize operations in the Mon",5.0,Thursday,2026-02-12,2.0,2026.0,False,1,2026-02,long
digitalocean,v86lxs9fkd3n,App platform seeing delays in deployments across all regions.,minor,2026-02-11 11:50:09.826000+00:00,2026-02-11 13:08:38.986000+00:00,78.5,3,1,['Global'],https://stspg.io/jnqjvkqwy0p8,"Our engineers are currently investigating an issue impacting new App Platform deployments. During this time, some users may experience delay when creating new App Platform apps. Existing apps are not ",11.0,Wednesday,2026-02-11,2.0,2026.0,False,2,2026-02,long
digitalocean,l5cn824y23b3,Cloud Control Panel,minor,2026-02-03 17:27:12.790000+00:00,2026-02-03 18:53:19.144000+00:00,86.1,5,2,"['API', 'Cloud Control Panel']",https://stspg.io/hsgp2dqk83jk,Our Engineering team is investigating an issue impacting our Cloud Control Panel and API. Users attempting to make API requests could see 5xx errors and users attempting to access the Cloud Control Pa,17.0,Tuesday,2026-02-03,2.0,2026.0,False,4,2026-02,long
digitalocean,7jwkcbg34qsp,Kubernetes Clusters and Droplets in FRA1 region,minor,2026-01-28 11:27:05.713000+00:00,2026-01-28 17:37:47.885000+00:00,370.7,4,2,"['FRA1', 'FRA1']",https://stspg.io/2z65vksnq8th,"Our Engineering team is investigating an issue with Kubernetes clusters in the FRA1 region. During this time, subset of users may experience an issue while provisioning Kubernetes clusters and mountin",11.0,Wednesday,2026-01-28,1.0,2026.0,False,1,2026-01,long
digitalocean,3lq0zklcll0k,Droplet Based Events in FRA1,minor,2026-01-28 00:45:47.342000+00:00,2026-01-28 04:27:19.268000+00:00,221.5,3,4,"['FRA1', 'FRA1', 'FRA1', 'FRA1']",https://stspg.io/f6s0bd11613v,"Our Engineering team is currently investigating an issue affecting events in FRA1. During this time, customers may experience delays or errors when creating or deleting Droplets, as well as when using",0.0,Wednesday,2026-01-28,1.0,2026.0,False,1,2026-01,long
digitalocean,fv4s9bqmq41q,Cloud Control Panel and API,major,2026-01-26 21:06:57.598000+00:00,2026-01-26 22:44:05.589000+00:00,97.1,3,2,"['API', 'Cloud Control Panel']",https://stspg.io/4prtndy9bd0t,"Our Engineering team is investigating an issue impacting multiple services including the Cloud Control Panel and API.

Users may encounter errors when accessing their accounts or using the API.

We ar",21.0,Monday,2026-01-26,1.0,2026.0,False,2,2026-01,long
digitalocean,0n647pxkdmg8,App Platform Deployments,minor,2026-01-20 18:05:02.953000+00:00,2026-01-20 18:25:19.423000+00:00,20.3,2,1,['Global'],https://stspg.io/xdgzbhvv0193,Our Engineering team has implemented necessary changes to address the issue impacting both new and in-progress App Platform Deployments. Our team is currently monitoring the situation. Users should no,18.0,Tuesday,2026-01-20,1.0,2026.0,False,2,2026-01,short
digitalocean,pbkc3n1l5p69,Account access and Payment,minor,2026-01-15 07:16:00.722000+00:00,2026-01-15 09:18:57.270000+00:00,122.9,2,3,"['Global', 'Billing', 'Cloud Control Panel']",https://stspg.io/0qxv5cvz6df9,Our engineering team is investigating an issue with the suspended user's accounts being unable to access the accounts. During this time users may have experience issues signing in or accessing account,7.0,Thursday,2026-01-15,1.0,2026.0,False,1,2026-01,long
digitalocean,l6sjf6bftj1z,App Platform Static Websites in NYC3 Region,minor,2025-12-18 19:25:08.536000+00:00,2025-12-18 22:34:33.600000+00:00,189.4,3,1,['New York'],https://stspg.io/4yt89q6fqdmh,"As of 17:45 UTC, our Engineering team is investigating reports of static site deployment failures in the NYC3 region on App Platform. Users may experience errors when attempting to deploy new static s",19.0,Thursday,2025-12-18,12.0,2025.0,False,1,2025-12,long
digitalocean,q39pqxrdmfxx,API and Cloud Requests,minor,2025-12-18 18:46:46.287000+00:00,2025-12-18 21:34:34.759000+00:00,167.8,2,2,"['API', 'Cloud Control Panel']",https://stspg.io/pt2c38386cj0,"As of 17:47 UTC, our Engineering team is investigating reports of intermittent 504 errors when making requests to api.digitalocean.com and cloud.digitalocean.com. Users may experience sporadic errors,",18.0,Thursday,2025-12-18,12.0,2025.0,False,1,2025-12,long
digitalocean,6d03lqrt8y1y,Spaces Access Keys and DigitalOcean Container Registry,none,2025-12-15 16:19:58.944000+00:00,2025-12-15 16:19:59.006000+00:00,0.0,1,2,"['AMS3', 'AMS3']",https://stspg.io/wlp93lqgd2w4,"From 08:28 to 13:03 UTC, Our Engineering team observed an issue with Spaces Access keys for DOCR in AMS3 region.  During this time, users encountered an error with ""403 (InvalidAccessKeyId): The acces",16.0,Monday,2025-12-15,12.0,2025.0,False,1,2025-12,short
digitalocean,v45dn1l41w75,Recovery Console Accessibility,minor,2025-12-10 20:33:12.119000+00:00,2025-12-11 00:00:09.600000+00:00,207.0,3,1,['Global'],https://stspg.io/j53mpsqfkn59,"Our Engineering team is actively investigating an issue causing the Recovery Console to be unavailable. 

Droplet functionality is not impacted. If customers need recovery iso, they can still select t",20.0,Wednesday,2025-12-10,12.0,2025.0,False,1,2025-12,long
digitalocean,fjkv8m6qphr7,App Platform Static Websites,minor,2025-12-10 18:08:12.790000+00:00,2025-12-10 19:08:21.585000+00:00,60.1,3,1,['Global'],https://stspg.io/sc874w2gb64r,"Our Engineering team is currently investigating an issue impacting App Platform static websites. During this period, users may notice 404 Not Found errors while accessing the sites.  

Our team is act",18.0,Wednesday,2025-12-10,12.0,2025.0,False,2,2025-12,long
digitalocean,lqyryfqpm9x5,DOCR Access Errors for New App Creation,minor,2025-12-09 20:41:33.171000+00:00,2025-12-09 22:08:39.180000+00:00,87.1,3,1,['BLR1'],https://stspg.io/yvgt6nnn1ylm,Our Engineering team is currently investigating an issue affecting the creation of new apps in the BLR1 region. Customers who have not previously created an app may encounter DOCR (DigitalOcean Contai,20.0,Tuesday,2025-12-09,12.0,2025.0,False,2,2025-12,long
digitalocean,528ghwz6806b,Control Panel Access,minor,2025-12-05 09:23:21.884000+00:00,2025-12-05 10:06:38.175000+00:00,43.3,4,5,"['API', 'Global', 'Global', 'Global', 'Cloud Control Panel']",https://stspg.io/5sshg87z2w5g,Our Engineering team has been made aware of an issue with an upstream provider that was affecting the Control Panel and API and has deployed a fix to resolve it. Users may have experienced issues sign,9.0,Friday,2025-12-05,12.0,2025.0,False,4,2025-12,short
digitalocean,kw1ms7q9gqsx,Degradation in Managed Databases,minor,2025-12-04 18:03:57.161000+00:00,2025-12-04 22:04:05.922000+00:00,240.1,3,1,['Global'],https://stspg.io/d56qlw805ywv,"As of 16:34 UTC, our Engineering team is investigating reports of errors and timeouts on control plane operations for Managed Databases. The issue is affecting multiple database engines, including Pos",18.0,Thursday,2025-12-04,12.0,2025.0,False,1,2025-12,long
digitalocean,c248f883bkv0,Gradient AI Platform – Service Degradation,none,2025-12-04 11:00:00+00:00,2025-12-04 11:00:00+00:00,0.0,1,0,[],https://stspg.io/x898xm2jcf4f,"During the timeframe 06:24 UTC – 13:45 UTC, the Gradient AI platform experienced a period of degraded functionality affecting a limited set of features. While the platform remained accessible, the bel",11.0,Thursday,2025-12-04,12.0,2025.0,False,0,2025-12,short
digitalocean,cc9hpt069n76,Guardrails Service Disruption Impacting Customers,minor,2025-12-02 20:55:20.136000+00:00,2025-12-03 15:45:50+00:00,1130.5,4,1,['Gradient AI'],https://stspg.io/cv08wwz42ybz,"As of 20:07 UTC on December 2, 2025, our Engineering team has detected increased guardrail latency which may produce long response times for agents with attached guardrails. Engineering is working on ",20.0,Tuesday,2025-12-02,12.0,2025.0,True,2,2025-12,long
digitalocean,hdl716jq8pxl,Managed Databases,none,2025-11-24 20:19:11.425000+00:00,2025-11-24 20:19:11.493000+00:00,0.0,1,1,['Global'],https://stspg.io/bm11qz66j1rc,"From 18:55 to 19:32 UTC, Our Engineering team observed an issue with all control plane operations (Create, Scale, Fork, etc ) for all non-Mongo Managed Database clusters.  During this time, users enco",20.0,Monday,2025-11-24,11.0,2025.0,False,1,2025-11,short
digitalocean,lgt5xs2843rx,Multiple Services Disruption,minor,2025-11-18 12:26:51.169000+00:00,2025-11-18 20:39:03.496000+00:00,492.2,4,6,"['API', 'Global', 'Global', 'Global', 'Global', 'Gradient AI']",https://stspg.io/6xgkqbsblsl4,"Our Engineering team is actively investigating an issue impacting multiple DigitalOcean services caused by an upstream provider incident. This disruption affects a subset of Gen AI tools, the App Plat",12.0,Tuesday,2025-11-18,11.0,2025.0,False,1,2025-11,long
digitalocean,h88jv8qz32v7,Block Storage Volumes in NYC1 and AMS3,none,2025-11-17 19:26:50.096000+00:00,2025-11-17 19:26:50.175000+00:00,0.0,1,2,"['AMS3', 'NYC1']",https://stspg.io/3mz2pgn9k9kd,"From 16:59 to 17:34 UTC, our Engineering team observed an issue with block storage volumes in the NYC1 and AMS3 regions. During this time, users may have experienced failures when attempting create, s",19.0,Monday,2025-11-17,11.0,2025.0,False,1,2025-11,short
digitalocean,pq520421vl6z,"Creation Events Failing for Spaces, App Platform, DOCR",minor,2025-11-16 08:31:13.738000+00:00,2025-11-16 11:05:14.143000+00:00,154.0,3,4,"['Global', 'Global', 'Global', 'Global']",https://stspg.io/bpn07hv72ywl,"Our engineering team is investigating an issue with failed create events with their Spaces, App Platform, and DOCR services. At this time, users may experience errors when creating Spaces, App Platfor",8.0,Sunday,2025-11-16,11.0,2025.0,False,1,2025-11,long
digitalocean,x0jf50r0hq5k,Network Connectivity in BLR1,minor,2025-11-08 18:07:20.918000+00:00,2025-11-09 07:11:28.317000+00:00,784.1,2,1,['BLR1'],https://stspg.io/h5kspzchk2c3,"Our Engineering team is still observing intermittent issues impacting network connectivity in the BLR1 region. Between 17:28 and 17:37 UTC, the team observed a major connectivity loss to this region a",18.0,Saturday,2025-11-08,11.0,2025.0,True,1,2025-11,long
digitalocean,4vs70qvnykcy,Network connectivity in BLR1,none,2025-11-08 15:15:27.293000+00:00,2025-11-08 15:15:27.346000+00:00,0.0,1,1,['BLR1'],https://stspg.io/3q7t7qc436fm,"From 13:50 to 14:15 UTC, our Engineering team observed an issue with an upstream provider impacting network connectivity in the BLR1 region.

During this time, users may have experienced increase in l",15.0,Saturday,2025-11-08,11.0,2025.0,False,1,2025-11,short
digitalocean,yq898vpw1nch,Gradient AI Platform Agent Creation.,minor,2025-10-29 20:26:07.852000+00:00,2025-10-29 23:59:32.531000+00:00,213.4,5,1,['Gradient AI'],https://stspg.io/1bh1kxsqry6j,"As of 18:50 UTC, our Engineering team is investigating reports of agent creation issues impacting customers using a VPC on the GradientAI platform. At this point, affected users may experience errors ",20.0,Wednesday,2025-10-29,10.0,2025.0,False,4,2025-10,long
