service,id,name,impact,created_at,resolved_at,duration_minutes,num_updates,num_components,components,shortlink,first_update,created_hour,created_weekday,created_date,created_month,created_year,is_outlier,first_hour_updates,year_month,duration_class
atlassian,8xc8jr91pcjh,Issues with 403 user authentication errors across Atlassian products,none,2025-03-04 07:31:46.048000+00:00,2025-03-04 07:31:46.088000+00:00,0.0,1,0,[],https://stspg.io/d9vzr30gswqr,"We are aware of an issue that was impacting user authentication to Atlassian services between 6:10AM Tuesday 4th March UTC and 6:35AM Tuesday 4th March UTC.
Users that were already logged in would not",7.0,Tuesday,2025-03-04,3.0,2025.0,False,1,2025-03,short
atlassian,kl4d5mfn26kc,Slowness in Jira.,none,2024-09-02 09:23:21.124000+00:00,2024-09-10 13:15:07.668000+00:00,11751.8,4,0,[],https://stspg.io/gnd70qwf3n98,Our team is currently investigating the issue. We are working to identify the cause and will provide updates as soon as possible.,9.0,Monday,2024-09-02,9.0,2024.0,True,1,2024-09,long
atlassian,m0nz4gbbjmz2,Slow loading times and extended response times for Cloud products in the EU-West region.,none,2024-09-10 10:26:14.585000+00:00,2024-09-10 12:43:48.654000+00:00,137.6,2,0,[],https://stspg.io/7kv4zlyf4fmn,"We are investigating issues with slow loading and long responsive time for all products (Jira, JSM, JSW and Confluence) and will provide updates here soon.",10.0,Tuesday,2024-09-10,9.0,2024.0,False,1,2024-09,long
atlassian,d8jljnw353f3,High RDS CPU on multiple environments,none,2024-09-09 08:56:21.454000+00:00,2024-09-09 18:12:32.915000+00:00,556.2,6,0,[],https://stspg.io/6w6ly5cgydvz,"We are investigating issues with Latency and 5xx errors for Jira, Jira Service Management, Jira Work Management due to High RDS CPU on several EU-Central environment and will provide updates here soon",8.0,Monday,2024-09-09,9.0,2024.0,True,1,2024-09,long
atlassian,2rsqj1hmdg82,Data residency migrations halted.,minor,2024-08-20 11:46:28+00:00,2024-08-23 11:15:08.487000+00:00,4288.7,2,0,[],https://stspg.io/pd9n7p9p3vb4,"Data residency migrations are currently not possible for Cloud customers. If you attempt a Data residency migration, you will encounter an error message, “We are unable to schedule your move” when you",11.0,Tuesday,2024-08-20,8.0,2024.0,True,1,2024-08,long
atlassian,2spys43jxslj,Some products are hard down,none,2024-07-03 20:51:01.430000+00:00,2024-07-04 03:54:28.906000+00:00,423.5,3,0,[],https://stspg.io/7h7xnnb9dcq5,"We are investigating an issue with <FUNCTIONALITY IMPACTED> that is impacting <SOME/ALL> Atlassian, Atlassian Partners, Atlassian Support, Confluence, Jira Work Management, Jira Service Management, Ji",20.0,Wednesday,2024-07-03,7.0,2024.0,False,2,2024-07,long
atlassian,4dh7m57xqhfq,Some of the www.atlassian.com pages are inaccessible,none,2024-06-06 01:30:44.228000+00:00,2024-06-06 04:30:02.883000+00:00,179.3,3,0,[],https://stspg.io/qn6bhjbczv28,"We are investigating reports of intermittent errors on some Atlassian, Opsgenie, Atlassian Access, and Compass-related www.atlassian.com web pages. Once we identify the root cause, we will provide mor",1.0,Thursday,2024-06-06,6.0,2024.0,False,1,2024-06,long
atlassian,5187qzxv1zvg,User searches failing,none,2024-02-07 16:40:28.383000+00:00,2024-02-07 17:44:38.545000+00:00,64.2,3,0,[],https://stspg.io/nwbhj091jbtg,"We are investigating an issue with our user search service that is impacting Atlassian cloud service: Confluence, Jira Work Management, Jira Service Management, Jira Software, Atlassian Bitbucket, Jir",16.0,Wednesday,2024-02-07,2.0,2024.0,False,2,2024-02,long
atlassian,71sdcbz9gy53,Delayed SCIM provisioning syncs of users and groups from Identity Providers,none,2024-01-09 22:03:34.293000+00:00,2024-01-12 17:13:28.840000+00:00,4029.9,7,0,[],https://stspg.io/trcvys1bxjkn,"We are investigating cases of degraded performance when SCIM provisioning users/groups for Confluence, Jira Work Management, Jira Service Management, Jira Software, and Atlassian Access Cloud customer",22.0,Tuesday,2024-01-09,1.0,2024.0,True,1,2024-01,long
atlassian,httczs7wslz8,Org admins unable to access User Management,none,2023-11-22 04:27:42.585000+00:00,2023-11-22 04:27:42.621000+00:00,0.0,1,0,[],https://stspg.io/27c3y3x0cfz8,"Between 01:18 AM UTC to 03:31 AM UTC, we encountered a problem where some organisation admins were not able to access User Management on the Admin hub. We have identified the root cause of this issue ",4.0,Wednesday,2023-11-22,11.0,2023.0,False,1,2023-11,short
atlassian,3sf6vg9v8nqm,Email domain unverified,major,2023-10-24 00:22:32.906000+00:00,2023-10-24 10:00:52.049000+00:00,578.3,8,0,[],https://stspg.io/xlcrsntd8s3p,We are investigating an issue with emails that have been sent out to admins stating domain verification is failing. We will provide more details within the next hour.,0.0,Tuesday,2023-10-24,10.0,2023.0,True,1,2023-10,long
atlassian,b2lqb2yxry16,"For a limited number of customers, activation for new products on some tenants is blocked",none,2023-10-04 14:28:06.493000+00:00,2023-10-04 17:20:32.547000+00:00,172.4,6,0,[],https://stspg.io/9q0x4gy5g22l,"We identified an issue with the product provisioning service. We identified the issue and we are working on a fix. 
We will post an update in the next hour with estimated fix time",14.0,Wednesday,2023-10-04,10.0,2023.0,False,2,2023-10,long
atlassian,lgl84rzhxd0d,We are experiencing intermittent issues on Atlassian.com and Bitbucket Marketing pages,none,2023-09-29 16:26:31+00:00,2023-09-29 20:27:18.153000+00:00,240.8,4,0,[],https://stspg.io/7nk14plf0xcd,We are investigating cases of degraded performance for Atlassian Cloud customers. We will provide more details within the next hour.,16.0,Friday,2023-09-29,9.0,2023.0,False,1,2023-09,long
atlassian,4jkh49j0jjh6,Infrastructure outage affecting attachments and Bitbucket Pipelines in all regions,none,2023-09-15 04:02:24.314000+00:00,2023-09-15 05:19:25.622000+00:00,77.0,4,0,[],https://stspg.io/s2kkn9vx51tc,A major infrastructure outage is affecting our ability to scale up in response to customer traffic. We are pre-emptively disabling any downscaling to minimize future impact. This is primarily affectin,4.0,Friday,2023-09-15,9.0,2023.0,False,3,2023-09,long
atlassian,vk4mksp2hvj8,"Sign-ups, Product Activation, and Billing not working",none,2023-08-02 14:25:40.168000+00:00,2023-08-02 15:59:20.026000+00:00,93.7,2,0,[],https://stspg.io/xq6c1zxx042m,"We have identified the root cause of the Sign-ups, Product Activation, and Billing not working and have mitigated the problem. We are now monitoring closely.",14.0,Wednesday,2023-08-02,8.0,2023.0,False,1,2023-08,long
atlassian,fthwx4svyskf,Sign-up is failing,none,2022-08-05 06:41:46.349000+00:00,2022-08-05 06:41:46.390000+00:00,0.0,1,0,[],https://stspg.io/vfl8l062168l,"Between 05:15 UTC to 05:55 UTC, we experienced user registration failing. The issue has been resolved and the service is operating normally.",6.0,Friday,2022-08-05,8.0,2022.0,False,1,2022-08,short
atlassian,wpphfps5ffpj,Partial app outage across multiple regions,none,2022-06-22 03:17:07.004000+00:00,2022-06-22 03:33:33.007000+00:00,16.4,2,0,[],https://stspg.io/g9syxmx696d8,"We are investigating reports of intermittent errors for some marketplace apps across the following regions: apse, eu west and eu central. Service has now been restored to each of the affected regions.",3.0,Wednesday,2022-06-22,6.0,2022.0,False,2,2022-06,short
atlassian,yz4mkc6j501q,Atlassian account session invalidations,none,2021-04-19 04:32:10.845000+00:00,2021-04-30 01:34:05.130000+00:00,15661.9,2,0,[],https://stspg.io/ql9jsw73ndfh,"We are investigating an incident impacting Jira Cloud, Confluence Cloud, Bitbucket Cloud, and Statuspage. During our investigation, users may be logged out of their accounts as we work towards a resol",4.0,Monday,2021-04-19,4.0,2021.0,True,1,2021-04,long
atlassian,r021q1l6nr1r,User Management Syncs are affected across all products,none,2021-02-12 02:28:07.620000+00:00,2021-02-12 03:13:32.641000+00:00,45.4,2,0,[],https://stspg.io/tlr74xv5fd4g,We continue investigating issues with syncing User Management changes to products. We will provide more details in an hour.,2.0,Friday,2021-02-12,2.0,2021.0,False,2,2021-02,short
atlassian,wkg98r6wc1b5,Login / Signup with Microsoft not working,major,2020-09-28 23:39:35.045000+00:00,2020-09-29 01:03:24.701000+00:00,83.8,2,0,[],http://stspg.io/n55q9mvx3w62,"We are investigating reports of intermittent errors for some Atlassian, Confluence, Jira Core, Jira Service Desk, Jira Software, Opsgenie, Atlassian Developer, Trello, and Atlassian Bitbucket Cloud cu",23.0,Monday,2020-09-28,9.0,2020.0,False,1,2020-09,long
atlassian,85fh4cc7749r,Increased latency in user searches,none,2020-01-22 22:19:48.395000+00:00,2020-01-22 23:11:44.151000+00:00,51.9,2,0,[],http://stspg.io/c641pfy1nrg6,"We are investigating cases of degraded performance for the user search component affecting Confluence, Jira Core, Jira Service Desk, Jira Software, and Bitbucket Cloud customers. Some customers may ex",22.0,Wednesday,2020-01-22,1.0,2020.0,False,2,2020-01,short
atlassian,kw28xr3wyxmq,Intermittent DNS Resolution Errors,none,2019-10-22 22:32:42.112000+00:00,2019-10-23 04:02:08.499000+00:00,329.4,6,0,[],http://stspg.io/e1be96263,We are aware that some customers may be experiencing intermittent failure connecting to Atlassian Cloud. We are working with our cloud hosting provider (AWS) to resolve the DNS related errors. We will,22.0,Tuesday,2019-10-22,10.0,2019.0,False,1,2019-10,long
atlassian,skl1wrm8z4yd,Major outage affecting all purchasing systems,none,2019-09-30 17:40:32.830000+00:00,2019-09-30 19:37:26.857000+00:00,116.9,3,0,[],http://stspg.io/91e56f832,"We are currently investigating an incident involving all purchasing systems.

Currently all customers will be unable to:
- sign up for new products.
- receive quotes on or purchase market place ad",17.0,Monday,2019-09-30,9.0,2019.0,False,1,2019-09,long
atlassian,dd0svkqq6dwg,Issues displaying avatars,none,2019-09-10 10:05:23.447000+00:00,2019-09-10 11:45:48.611000+00:00,100.4,2,0,[],http://stspg.io/3961cf9c1,We are investigating an issue with our avatar storage system that is impacting visibility of avatars across multiple services. We will provide more details as they're discovered.,10.0,Tuesday,2019-09-10,9.0,2019.0,False,1,2019-09,long
atlassian,gzrclxcqvdsp,"Increased error rate in US East for Atlassian Jira, Confluence and Access customers",none,2019-07-15 15:42:29.613000+00:00,2019-07-15 17:08:58.823000+00:00,86.5,2,0,[],http://stspg.io/85a9f9caa,"We are investigating an issue with Atlassians API Gateway in US East that is impacting some Access, Jira and Confluence Cloud customers. We will provide more details within the next hour.",15.0,Monday,2019-07-15,7.0,2019.0,False,1,2019-07,long
atlassian,w81fyrpz5qcl,App switcher not loading in Jira and Confluence for some customers,major,2019-07-01 09:03:21.600000+00:00,2019-07-01 11:03:40.319000+00:00,120.3,3,0,[],http://stspg.io/d2bfd779a,We are investigating an issue with app switcher that is impacting some Atlassian Cloud customers. We will provide more details within the next hour.,9.0,Monday,2019-07-01,7.0,2019.0,False,1,2019-07,long
atlassian,sqq15l5bd34s,Atlassian Cloud email notifications issue,major,2019-06-19 12:00:14.371000+00:00,2019-06-20 12:39:11.020000+00:00,1478.9,3,0,[],http://stspg.io/d5b25c71b,We are investigating an issue with outgoing email that is impacting some Atlassian Cloud customers. We will provide more details within the next hour.,12.0,Wednesday,2019-06-19,6.0,2019.0,True,1,2019-06,long
atlassian,7tmh679kh794,Jira sidebar colour is not changing base on configuration,none,2019-05-21 09:53:42.330000+00:00,2019-05-21 09:53:42.382000+00:00,0.0,1,0,[],http://stspg.io/60b483de7,We have identified the root cause of the custom sidebar colour issue with Jira Cloud and have mitigated the problem. The issue has been resolved and the service is operating normally.,9.0,Tuesday,2019-05-21,5.0,2019.0,False,1,2019-05,short
atlassian,3p4zfxggg0vv,Atlassian Cloud users experiencing outages,critical,2019-05-14 08:57:38.614000+00:00,2019-05-14 11:04:20.413000+00:00,126.7,3,0,[],http://stspg.io/9c0c8c681,We are investigating an outage that is impacting some Atlassian Cloud customers. We will provide more details within the next hour.,8.0,Tuesday,2019-05-14,5.0,2019.0,False,2,2019-05,long
atlassian,dgsyrnqfr2r0,Jira Users Receiving HTTP 500 Errors,major,2019-05-10 14:10:29.132000+00:00,2019-05-10 14:37:03.785000+00:00,26.6,2,0,[],http://stspg.io/cb7cd57ba,We are investigating an issue with Jira Cloud that is impacting some of our Atlassian Cloud customers. We will provide more details within the next hour.,14.0,Friday,2019-05-10,5.0,2019.0,False,2,2019-05,short
atlassian,mx1wvlvbw23y,Jira Imports are Failing,major,2019-05-07 07:30:37.229000+00:00,2019-05-07 09:45:37.229000+00:00,135.0,1,0,[],http://stspg.io/06e0ed12a,"Between 06/May/2019 06:00 AM UTC to 07/May/2019 09:10 AM UTC, we experienced issues with Jira imports. The issue has been resolved and the service is operating normally.",7.0,Tuesday,2019-05-07,5.0,2019.0,False,0,2019-05,long
cloudflare,xx44fv4qfnch,Increased HTTP 5xx errors in Philadelphia colo,minor,2026-04-10 15:55:36.889000+00:00,2026-04-10 17:04:15.463000+00:00,68.6,4,1,"['Philadelphia, United States - (PHL)']",https://stspg.io/831jqtmk0x6j,Cloudflare is investigating an increased level of 5xx errors in Philadelphia. We are working to analyse and mitigate this problem. More updates to follow shortly.,15.0,Friday,2026-04-10,4.0,2026.0,False,3,2026-04,long
cloudflare,wt7ydt03k9hb,Workers Assets increased upload failure,minor,2026-04-10 14:06:38.463000+00:00,2026-04-10 16:26:25.869000+00:00,139.8,3,1,['Workers Assets'],https://stspg.io/1dytcb9yxvc5,"Cloudflare has identified an issue impacting Workers Assets uploads. Customers may be seeing an increase in Workers Assets upload failures.

This issues does not affect the serving of Workers Assets t",14.0,Friday,2026-04-10,4.0,2026.0,False,1,2026-04,long
cloudflare,ysv5lb7wdwht,Increased HTTP 5xx errors in Philadelphia colo,none,2026-04-09 14:30:00+00:00,2026-04-09 14:30:00+00:00,0.0,1,0,[],https://stspg.io/rlgdgkwg9lr0,"Between 14:41 and 16:34 UTC on April 9th, 2026, we experienced an elevated level of HTTP 5xx errors affecting traffic through our Philadelphia (PHL) data center. The issue has been mitigated now.",14.0,Thursday,2026-04-09,4.0,2026.0,False,0,2026-04,short
cloudflare,9wt5yhn1lcm1,Network performance issues in MIA and ATL regions,none,2026-04-08 19:30:00+00:00,2026-04-08 19:30:00+00:00,0.0,1,0,[],https://stspg.io/g5q9p32x8sjr,"Between 19:47 and 21:57UTC on April 8, 2026, Cloudflare identified and mitigated a network performance issue specifically affecting our Miami and Atlanta regions. 
Users may have experienced increased",19.0,Wednesday,2026-04-08,4.0,2026.0,False,0,2026-04,short
cloudflare,sl49fdmqvzxf,Issues with the Cloudflare One Dashboard,minor,2026-04-08 07:28:25.626000+00:00,2026-04-08 09:48:48.840000+00:00,140.4,3,1,['Zero Trust Dashboard'],https://stspg.io/37rl2pm3hpfc,"Cloudflare is investigating issues with operations on the Cloudflare One Dashboard.

Customers using the Cloudflare One dashboard are impacted. Customers may face issues when creating a new device pro",7.0,Wednesday,2026-04-08,4.0,2026.0,False,2,2026-04,long
cloudflare,b8dkfysdvf3l,"Increased HTTP 5XX Errors in Sao Paulo, GRU",none,2026-04-08 06:30:00+00:00,2026-04-08 06:45:00+00:00,15.0,1,0,[],https://stspg.io/vnzcsv57kkzz,Cloudflare investigated increased HTTP 5XX errors in Sau Paulo between 0645: - 06:55 UTC. Issue has been resolved,6.0,Wednesday,2026-04-08,4.0,2026.0,False,0,2026-04,short
cloudflare,hcymjjyr55rs,Analytics Delays and Errors,minor,2026-04-07 15:55:29.853000+00:00,2026-04-07 17:04:09.468000+00:00,68.7,3,1,['Analytics'],https://stspg.io/m7cshdtc3fv2,"Cloudflare Analytics processing is running behind. This affects timely delivery of customer data. This also affects querying data, and some users may see errors when trying to view or access analytics",15.0,Tuesday,2026-04-07,4.0,2026.0,False,2,2026-04,long
cloudflare,w7v0csd4n8yj,Cloudflare Dashboard and Cloudflare API service issues,minor,2026-04-07 13:27:00.707000+00:00,2026-04-07 14:27:29.412000+00:00,60.5,6,2,"['API', 'Dashboard']",https://stspg.io/q3mgy1m89bh2,Cloudflare is investigating issues with Cloudflare Dashboard and related APIs. These issues do not affect the serving of cached files via the Cloudflare CDN or other security features at the Cloudflar,13.0,Tuesday,2026-04-07,4.0,2026.0,False,5,2026-04,long
cloudflare,9s1zx8zyp36q,Cloudflare Durable Objects Availability in Western North America,minor,2026-04-07 12:07:24.281000+00:00,2026-04-07 13:26:38.078000+00:00,79.2,3,1,['Durable Objects'],https://stspg.io/qzdz1h2btpw4,"Cloudflare is aware of, and is investigating issues related to Durable Objects in Western North America. Further detail will be provided as more information becomes available.",12.0,Tuesday,2026-04-07,4.0,2026.0,False,1,2026-04,long
cloudflare,qdhn9k7z8tsy,Cloudflare Dashboard and Cloudflare API service issues,minor,2026-04-07 09:21:12.356000+00:00,2026-04-07 12:08:23.902000+00:00,167.2,4,1,['API'],https://stspg.io/d3nxf3dgxvcs,Cloudflare is investigating issues with Cloudflare Dashboard and related APIs. These issues do not affect the serving of cached files via the Cloudflare CDN or other security features at the Cloudflar,9.0,Tuesday,2026-04-07,4.0,2026.0,False,2,2026-04,long
cloudflare,r2p4nkdxwgzf,Cloudflare Debian Mirror Issues,minor,2026-04-07 11:08:33.209000+00:00,2026-04-07 11:51:48.949000+00:00,43.3,3,1,['Infrastructure'],https://stspg.io/qj2gsfrj4qc9,Cloudflare is aware of and investigating an issue with https://cloudflaremirrors.com/debian returning errors when trying to pull from it. This issue does not affect any other Cloudflare services. We a,11.0,Tuesday,2026-04-07,4.0,2026.0,False,3,2026-04,short
cloudflare,xp9mwbvzyjjb,Increased Durable Object Errors in AMS,minor,2026-04-07 07:17:30.850000+00:00,2026-04-07 09:42:18.161000+00:00,144.8,3,2,"['Amsterdam, Netherlands - (AMS)', 'Durable Objects']",https://stspg.io/sd4kz0tcrw98,"Cloudflare is aware of, and investigating an issue with Durable Objects which potentially impacts multiple customers in the AMS region. Durable Objects are experiencing an elevated level of overload e",7.0,Tuesday,2026-04-07,4.0,2026.0,False,2,2026-04,long
cloudflare,dj2ry9zz8jdg,Smart Routing currently has reduced performance,minor,2026-04-06 23:56:59.288000+00:00,2026-04-07 09:37:04.783000+00:00,580.1,3,1,['Argo Smart Routing'],https://stspg.io/1dwvzwb249h4,Cloudflare has identified performance issues with Smart Routing. We have identified and applied related mitigations,23.0,Monday,2026-04-06,4.0,2026.0,True,2,2026-04,long
cloudflare,5w9bnp4tpqnq,Cloudflare API Availability,minor,2026-04-06 21:38:09+00:00,2026-04-06 22:42:04.575000+00:00,63.9,2,1,['API'],https://stspg.io/x4j29frgx0kw,Cloudflare resolved issues with Cloudflare Dashboard and related APIs. These issues do not affect the serving of cached files via the Cloudflare CDN or other security features at the Cloudflare Edge. ,21.0,Monday,2026-04-06,4.0,2026.0,False,1,2026-04,long
cloudflare,5gk4x9zhw6tx,Digital experience Logpush delay,minor,2026-04-06 15:18:27.183000+00:00,2026-04-06 20:14:05.987000+00:00,295.6,3,1,['Logs'],https://stspg.io/p4h4mf6fr9jf,Cloudflare One customers that use LogPush to ingest DEX Device State Events will see up to a 20 minute delay. DEX data in the dashboard and the API is not impacted,15.0,Monday,2026-04-06,4.0,2026.0,False,1,2026-04,long
cloudflare,vm3bgs566nrv,Delayed Cloudflare Page Shield data updates,minor,2026-04-06 04:52:54.336000+00:00,2026-04-06 15:46:51.995000+00:00,654.0,3,1,['Page Shield'],https://stspg.io/8mmdjyh1fv2n,Cloudflare is currently investigating an issue where data updates of the Page Shield product are delayed. More updates to follow shortly.,4.0,Monday,2026-04-06,4.0,2026.0,True,1,2026-04,long
cloudflare,x6rt392sc7m5,Delay in some zone configuration deployment,none,2026-04-06 15:00:00+00:00,2026-04-06 15:00:00+00:00,0.0,1,0,[],https://stspg.io/3d5tshy0z0g8,"We have resolved an issue that caused a minor delay in configuration deployments across a small number of zones between 14:56 and 20:36 UTC on April 5, 2026.",15.0,Monday,2026-04-06,4.0,2026.0,False,0,2026-04,short
cloudflare,pjx3nm483dgh,SOC alerting for Core applications was impacted,none,2026-04-06 01:59:46.009000+00:00,2026-04-06 01:59:46.069000+00:00,0.0,1,0,[],https://stspg.io/26085fm35g8f,"Between 16:11 UTC on April 5 and 00:14 UTC on April 6, an error impacted SOC alerting for Core applications. The issue has been resolved, and all systems are now fully operational. No ongoing impact i",1.0,Monday,2026-04-06,4.0,2026.0,False,1,2026-04,short
cloudflare,s29h7cf03vds,Queue resource error,minor,2026-04-03 23:53:19.258000+00:00,2026-04-04 03:04:54.943000+00:00,191.6,3,1,['Queues'],https://stspg.io/jddzwx072bdh,Cloudflare is investigating an increased level of errors for customers running updates to Queues via Terraform.,23.0,Friday,2026-04-03,4.0,2026.0,False,2,2026-04,long
cloudflare,kljzxjznrpm4,Customers using our Email Security product might see some links flagged as suspicious,none,2026-04-03 22:47:02.306000+00:00,2026-04-03 22:47:02.368000+00:00,0.0,1,2,"['Email Security (Area1)', 'Email Security (Zero Trust)']",https://stspg.io/wbtkp9k5txyt,"Emails were sent today with a signature that had a  a minor typo inadvertently caused it to flag legitimate emails. 
We have immediately corrected the issue, and going forward, these emails will no lo",22.0,Friday,2026-04-03,4.0,2026.0,False,1,2026-04,short
cloudflare,45bv19jtvnl9,Pages increased deployment errors,minor,2026-04-03 16:50:13.775000+00:00,2026-04-03 17:55:43.655000+00:00,65.5,4,1,['Pages'],https://stspg.io/w45xxqhlbq1t,"Cloudflare has identified an issue impacting Cloudflare Pages deployments of Pages Functions with R2 bindings. 
Customers may experience failures deploying their Pages Functions

We are working to ana",16.0,Friday,2026-04-03,4.0,2026.0,False,3,2026-04,long
cloudflare,nprdhrx1cx9b,"WARP connectivity issues affecting a subset of windows users, using latest version 2026.3.846.0.",minor,2026-04-03 08:08:05.347000+00:00,2026-04-03 09:03:02.405000+00:00,55.0,5,1,['Access'],https://stspg.io/n9rf1kw9gsck,We are currently investigating WARP connectivity issues after upgrade.,8.0,Friday,2026-04-03,4.0,2026.0,False,5,2026-04,short
cloudflare,lsb9p4jxhcdz,Elevated latency uploading Workers Static Assets,minor,2026-04-02 17:39:48.373000+00:00,2026-04-02 18:47:13.611000+00:00,67.4,2,1,['Workers Assets'],https://stspg.io/lj19hs21t69j,Cloudflare is investigating elevated latency uploading Workers Static Assets. Workers scripts which are already uploaded are not impacted.,17.0,Thursday,2026-04-02,4.0,2026.0,False,1,2026-04,long
cloudflare,dxhf5ttltj1j,Digital Experience Monitoring (DEX) Delay,minor,2026-04-02 16:50:25+00:00,2026-04-02 18:17:24.825000+00:00,87.0,3,1,['Digital Experience Monitoring (DEX)'],https://stspg.io/xyyxhpp2zvcb,Cloudflare is investigating an issue affecting Digital Experience Monitoring (DEX). Customers may experience delays in DEX data. We will provide updates as our investigation progresses.,16.0,Thursday,2026-04-02,4.0,2026.0,False,2,2026-04,long
cloudflare,s6vkxmtx7nhx,Issues with creating Managed Rules exceptions via the Cloudflare Dashboard,minor,2026-04-02 12:42:36.355000+00:00,2026-04-02 14:17:18.355000+00:00,94.7,4,1,['Dashboard'],https://stspg.io/f0pmlm7by9ch,"Cloudflare is investigating issues with creating Managed Rules exceptions via the Cloudflare Dashboard. These issues do not affect the Cloudflare API, serving of cached files via the Cloudflare CDN or",12.0,Thursday,2026-04-02,4.0,2026.0,False,1,2026-04,long
cloudflare,jp2x96lr8rsz,Cache Purging Delays,minor,2026-04-02 12:41:24.136000+00:00,2026-04-02 12:58:44.752000+00:00,17.3,3,2,"['CDN Cache Purge', 'Tokyo, Japan - (NRT)']",https://stspg.io/fg2y28ntfbvz,Cloudflare single-file cache purging (purge by URL) called via the Dashboard/API are delayed. We are working to resolve this issue as soon as possible. Until then you may use the Purge Everything feat,12.0,Thursday,2026-04-02,4.0,2026.0,False,3,2026-04,short
cloudflare,q11341q4x28m,Cloudflare AI Search Issues,minor,2026-04-02 09:05:39.648000+00:00,2026-04-02 10:29:03.540000+00:00,83.4,3,1,['AI Search'],https://stspg.io/gr187p5lxvd4,Cloudflare is aware of and investigating an issue with AI Search. Customers may observe 7001 and internal error messages. We are working to analyse and mitigate this problem. More updates to follow sh,9.0,Thursday,2026-04-02,4.0,2026.0,False,1,2026-04,long
cloudflare,2hh3phljpr7x,Increased 1003 / 403 errors in Workers,minor,2026-04-02 00:47:27+00:00,2026-04-02 08:36:40.572000+00:00,469.2,4,1,['Workers'],https://stspg.io/5kkjj5ncfcyc,"Cloudflare is aware of and investigating an issue impacting some Workers invocations. Customers may be seeing 1003/403 errors when doing fetch() calls inside a Worker.

We are working to mitigate this",0.0,Thursday,2026-04-02,4.0,2026.0,False,2,2026-04,long
cloudflare,n8ynj6lygzw3,Cloudflare Workers Issues in Chicago,minor,2026-04-02 08:08:03.871000+00:00,2026-04-02 08:28:59.662000+00:00,20.9,3,2,"['Chicago, IL, United States - (ORD)', 'Workers']",https://stspg.io/wmbpvbklgwgt,Cloudflare is investigating an increased level of errors for customers running Workers scripts in Chicago. We are working to analyse and mitigate this problem. More updates to follow shortly.,8.0,Thursday,2026-04-02,4.0,2026.0,False,3,2026-04,short
