service,id,name,impact,created_at,resolved_at,duration_minutes,num_updates,num_components,components,shortlink,first_update,created_hour,created_weekday,created_date,created_month,created_year,is_outlier,first_hour_updates,year_month,duration_class
reddit,6d1m99b88gnt,Elevated Errors,major,2025-05-16 22:47:35.882000+00:00,2025-05-16 23:53:40.194000+00:00,66.1,4,0,[],https://stspg.io/2k2p5rjz1bb4,We're experiencing an elevated level of errors and are currently looking into the issue.,15.0,Friday,2025-05-16,5.0,2025.0,False,3,2025-05,long
reddit,tzw7yxwqp6kb,Chat - elevated errors,major,2025-04-30 12:58:24.030000+00:00,2025-04-30 13:34:21.852000+00:00,36.0,4,2,"['Desktop Web', 'Native Mobile Apps']",https://stspg.io/rg45tw858zl7,We are currently investigating elevated errors in chat.,5.0,Wednesday,2025-04-30,4.0,2025.0,False,4,2025-04,short
reddit,f8tm205kh3y9,Investigating elevated site errors,major,2025-04-21 15:52:41.032000+00:00,2025-04-21 16:21:25.414000+00:00,28.7,4,2,"['Desktop Web', 'Native Mobile Apps']",https://stspg.io/v12k0lfcg8k5,We are currently investigating elevated errors across reddit.com and the apps.,8.0,Monday,2025-04-21,4.0,2025.0,False,4,2025-04,short
reddit,1fy8bll7qjms,Missing Action Buttons For Moderators,minor,2025-04-02 19:20:27.935000+00:00,2025-04-02 21:31:28.704000+00:00,131.0,3,2,"['Desktop Web', 'Native Mobile Apps']",https://stspg.io/hh9p3mt54lc4,Moderators are experiencing issues loading comment pages and moderating comments in their communities,12.0,Wednesday,2025-04-02,4.0,2025.0,False,1,2025-04,long
reddit,rvrpcx0smnh8,Degraded performance for reddit.com,none,2025-03-27 19:16:10.741000+00:00,2025-03-28 10:54:46.289000+00:00,938.6,3,1,['Reddit Infrastructure'],https://stspg.io/yzxl89065x2m,We are currently investigating this issue.,12.0,Thursday,2025-03-27,3.0,2025.0,True,2,2025-03,long
reddit,6bkg7hsl8zf3,Degraded performance for comments,minor,2025-03-25 17:06:01.809000+00:00,2025-03-25 19:30:39.311000+00:00,144.6,3,3,"['Desktop Web', 'Mobile Web', 'Native Mobile Apps']",https://stspg.io/2pcrhmm8kwx5,We are currently investigating this issue.,10.0,Tuesday,2025-03-25,3.0,2025.0,False,2,2025-03,long
reddit,t5ck4dt7pj31,Elevated Errors,minor,2025-03-24 21:29:18.732000+00:00,2025-03-24 21:52:56.216000+00:00,23.6,3,1,['Comment Processing'],https://stspg.io/dh83qzxbwm6h,We're experiencing an elevated level of API errors and are currently looking into the issue. You may notice a lag in comment publishing.,14.0,Monday,2025-03-24,3.0,2025.0,False,3,2025-03,short
reddit,f40dgv6fr8qk,Delayed Comments,major,2025-03-01 11:01:54.607000+00:00,2025-03-01 12:34:43.427000+00:00,92.8,4,1,['Comment Processing'],https://stspg.io/vrsjv66s3r21,We’re experiencing delayed new comments on Reddit and we’re looking in to the issue,3.0,Saturday,2025-03-01,3.0,2025.0,False,3,2025-03,long
reddit,g01bn6vpj1l5,Elevated Errors,none,2025-02-24 18:37:31.384000+00:00,2025-02-24 19:54:48.855000+00:00,77.3,4,0,[],https://stspg.io/j2ytbg4fzy9w,We're experiencing an elevated level of API errors and are currently looking into the issue.,10.0,Monday,2025-02-24,2.0,2025.0,False,3,2025-02,long
reddit,s9szfhh4bqb9,Elevated Errors,major,2025-02-22 00:58:40.355000+00:00,2025-02-22 02:47:36.605000+00:00,108.9,3,0,[],https://stspg.io/v893trmszpsv,We're experiencing an elevated level of errors and are currently looking into the issue.,16.0,Friday,2025-02-21,2.0,2025.0,False,2,2025-02,long
reddit,hys0bz1hfyld,Increase in errors,none,2025-02-18 22:17:31.460000+00:00,2025-02-18 22:57:28.802000+00:00,40.0,4,0,[],https://stspg.io/w0k76ynlv00k,"Post creation and updates are currently seeing an increase in errors, we are actively investigating and working on the issue.",14.0,Tuesday,2025-02-18,2.0,2025.0,False,4,2025-02,short
reddit,mlt4ymb57c3c,Site issues,none,2025-01-17 09:09:10.522000+00:00,2025-01-17 10:36:36.340000+00:00,87.4,3,3,"['Desktop Web', 'Mobile Web', 'Native Mobile Apps']",https://stspg.io/hnmh8j3fzrk4,We are currently investigating degraded performance of r/popular.,1.0,Friday,2025-01-17,1.0,2025.0,False,2,2025-01,long
reddit,y0gsrfy6dfrz,Degraded performance for reddit.com,minor,2024-11-21 15:51:25.825000+00:00,2024-11-21 16:19:01.711000+00:00,27.6,3,3,"['Desktop Web', 'Mobile Web', 'Native Mobile Apps']",https://stspg.io/r0620mjf7cf6,We are currently investigating a problem with our site.,7.0,Thursday,2024-11-21,11.0,2024.0,False,3,2024-11,short
reddit,xrnjyrbj4t2m,Degraded performance for reddit.com,minor,2024-11-20 20:38:08.155000+00:00,2024-11-21 04:08:02.219000+00:00,449.9,3,5,"['Desktop Web', 'Mobile Web', 'Native Mobile Apps', 'Comment Processing', 'Spam Processing']",https://stspg.io/7d8bsr0ztrzm,We are currently investigating this issue.,12.0,Wednesday,2024-11-20,11.0,2024.0,False,1,2024-11,long
reddit,4tr89ms0r453,Degraded performance for reddit.com,major,2024-11-06 04:07:09.645000+00:00,2024-11-06 13:00:05.539000+00:00,532.9,5,4,"['Desktop Web', 'Mobile Web', 'Native Mobile Apps', 'Vote Processing']",https://stspg.io/c73b3f7dwr7q,We are currently investigated degraded performance on reddit.com,20.0,Tuesday,2024-11-05,11.0,2024.0,True,2,2024-11,long
reddit,cc12j3tshch8,Web performance degraded,none,2024-10-14 08:12:39.662000+00:00,2024-10-14 15:33:33.588000+00:00,440.9,2,0,[],https://stspg.io/t4k2g11s3jwx,We are currently experience a performance degradation of our service. We are working to fix the problem.,1.0,Monday,2024-10-14,10.0,2024.0,False,1,2024-10,long
reddit,cjzbd0ksrkqx,Degraded Performance for reddit.com,minor,2024-09-19 19:15:14.738000+00:00,2024-09-19 20:22:16.043000+00:00,67.0,3,3,"['Native Mobile Apps', 'Vote Processing', 'Comment Processing']",https://stspg.io/sx8mrtj5t1bx,We are currently investigating this issue.,12.0,Thursday,2024-09-19,9.0,2024.0,False,2,2024-09,long
reddit,t8b942dzrwh1,Degraded Performance for reddit.com,critical,2024-08-28 20:16:34.656000+00:00,2024-08-28 21:16:47.180000+00:00,60.2,4,7,"['Desktop Web', 'Mobile Web', 'Native Mobile Apps', 'Vote Processing', 'Comment Processing', 'Spam Processing', 'Modmail']",https://stspg.io/tb3n3yc1jgzn,We are currently investigating this issue.,13.0,Wednesday,2024-08-28,8.0,2024.0,False,3,2024-08,long
reddit,v3twwbc6srn5,Degraded Performance for reddit.com,minor,2024-08-13 20:51:45.896000+00:00,2024-08-13 22:02:00.598000+00:00,70.2,4,4,"['Desktop Web', 'Reddit Ads', 'Mobile Web', 'Native Mobile Apps']",https://stspg.io/frgbt2k27fn6,We are currently investigating this issue.,13.0,Tuesday,2024-08-13,8.0,2024.0,False,3,2024-08,long
reddit,vj1wzh4m7f6n,Some subreddits/posts are failing to load,minor,2024-08-06 18:36:21.022000+00:00,2024-08-06 19:27:50.109000+00:00,51.5,3,3,"['Desktop Web', 'Mobile Web', 'Native Mobile Apps']",https://stspg.io/j0ynh7xlf55n,Some posts/subreddits are currently failing to load for web and mobile users. We've identified a likely culprit and are currently working to address it.,11.0,Tuesday,2024-08-06,8.0,2024.0,False,3,2024-08,short
reddit,4c1vjlptgddq,Comment Processing is Delayed,major,2024-07-14 00:24:33.947000+00:00,2024-07-14 01:51:41.271000+00:00,87.1,4,0,[],https://stspg.io/p3cg67mx46wf,We are aware of increased error rates with newly posted comments. We are currently investigating this issue.,17.0,Saturday,2024-07-13,7.0,2024.0,False,1,2024-07,long
reddit,kg3dvmrr1gs4,Elevated API Errors,minor,2024-07-08 18:43:24.951000+00:00,2024-07-08 19:54:51.736000+00:00,71.4,3,1,['Desktop Web'],https://stspg.io/3nwx9gzth2g7,We're experiencing an elevated level of API errors and are currently looking into the issue.,11.0,Monday,2024-07-08,7.0,2024.0,False,2,2024-07,long
reddit,wdhk0802p7sc,Comment tree processing is delayed,major,2024-06-28 02:17:49+00:00,2024-06-28 05:05:01.719000+00:00,167.2,5,1,['Comment Processing'],https://stspg.io/w0cxc254zl4k,We are aware that newly posted comments are not showing up immediately in comment trees. We are currently investigating this issue.,19.0,Thursday,2024-06-27,6.0,2024.0,False,1,2024-06,long
reddit,grx0wwqcq22b,Issues with new post creation,minor,2024-05-16 20:12:55.521000+00:00,2024-05-16 20:43:37.927000+00:00,30.7,2,3,"['Desktop Web', 'Mobile Web', 'Native Mobile Apps']",https://stspg.io/zkpqc3lswrsf,We are investigating reports that new posts with media are not being created correctly.,13.0,Thursday,2024-05-16,5.0,2024.0,False,2,2024-05,short
reddit,mtfmwh87wfr9,Post Detail Issues,minor,2024-05-03 19:46:16.431000+00:00,2024-05-03 21:27:30.936000+00:00,101.2,4,3,"['Desktop Web', 'Mobile Web', 'Comment Processing']",https://stspg.io/72xqvd374cc3,We're investigating an issue preventing comments and page details from loading.,12.0,Friday,2024-05-03,5.0,2024.0,False,3,2024-05,long
reddit,g5gvrxbzdqws,Images (gifs) and Media uploading and creation within Chat is degraded,none,2024-04-30 22:36:33.380000+00:00,2024-05-01 21:47:54.603000+00:00,1391.4,4,0,[],https://stspg.io/1tqmng0k5s9x,We are currently investigating this issue.,15.0,Tuesday,2024-04-30,4.0,2024.0,True,1,2024-04,long
reddit,014dkyf9dqfl,elevated error rates on many frontends #8256,none,2024-04-25 16:52:38.227000+00:00,2024-04-25 17:42:20.164000+00:00,49.7,5,6,"['Desktop Web', 'Reddit Ads', 'Mobile Web', 'Native Mobile Apps', 'Vote Processing', 'Comment Processing']",https://stspg.io/581xd6l0gzkj,An issue with a Reddit backend has impacted many users on our site. We are looking into the cause.,9.0,Thursday,2024-04-25,4.0,2024.0,False,5,2024-04,short
reddit,4smkkp3fp2tm,ads.reddit.com degraded for some users,none,2024-04-25 16:02:48.241000+00:00,2024-04-25 16:38:56.150000+00:00,36.1,3,1,['Reddit Ads'],https://stspg.io/ytmfg38c4412,"We have found a cause, and are currenting remediating the situation. Expected duration, 30 mins.",9.0,Thursday,2024-04-25,4.0,2024.0,False,3,2024-04,short
reddit,gkfqmw3fpq9q,Degraded performance on reddit.com and mobile apps,none,2024-04-22 20:47:15.108000+00:00,2024-04-22 21:34:22.244000+00:00,47.1,3,0,[],https://stspg.io/6z86q1zlrkx8,We are currently investigating this issue.,13.0,Monday,2024-04-22,4.0,2024.0,False,3,2024-04,short
reddit,gjcvnqy04yw2,Increased error rates for users,major,2024-04-02 21:16:02.311000+00:00,2024-04-02 23:57:25.387000+00:00,161.4,4,3,"['Desktop Web', 'Mobile Web', 'Native Mobile Apps']",https://stspg.io/5vmh4bvf66xv,We are currently investigating issues that are causing increased error rates for users.,14.0,Tuesday,2024-04-02,4.0,2024.0,False,2,2024-04,long
reddit,vl332nzd2f05,Images (gifs) and Media uploading and creation within Chat is degraded,none,2024-04-01 21:56:46.436000+00:00,2024-04-02 01:24:52.343000+00:00,208.1,3,0,[],https://stspg.io/h4615frpf78p,We are currently investigating this issue.,14.0,Monday,2024-04-01,4.0,2024.0,False,1,2024-04,long
reddit,bpcv3pfv37py,Slow Loading Times,none,2024-03-07 23:59:09.669000+00:00,2024-03-08 00:59:31.346000+00:00,60.4,3,0,[],https://stspg.io/vj18ymqm4r37,Users may be experiencing slower than normal load times.,15.0,Thursday,2024-03-07,3.0,2024.0,False,2,2024-03,long
twilio,6fdg59zzfdts,SMS Delivery Delays From a Subset of Twilio Short Codes to Algar Brazil,minor,2026-04-10 15:15:06.820000+00:00,2026-04-11 03:42:16.602000+00:00,747.2,7,1,"['SMS, Latin America']",https://stspg.io/8d9gqjr68qrj,Twilio customers may be experiencing SMS delivery delays from a subset of Twilio Short Codes to Algar network subscribers in Brazil. Our team is actively investigating this issue. We will provide anot,8.0,Friday,2026-04-10,4.0,2026.0,True,2,2026-04,long
twilio,cqglq75r5ffs,500 Errors for Twilio Verify on the Twilio Console,none,2026-04-10 21:05:33+00:00,2026-04-10 21:05:33+00:00,0.0,1,0,[],https://stspg.io/q4dwtf39qys0,"Twilio Verify on the Twilio Console was degraded on April 10th, 2026 between 10:48:40 AM PST and 10:55:40 AM PST. During this period of time customers may have experienced issues managing the Twilio V",14.0,Friday,2026-04-10,4.0,2026.0,False,1,2026-04,short
twilio,zxgrdybq2b7f,User Authentication Identity SNA and Gateway API Failures for T-Mobile in United States,minor,2026-04-10 10:38:44.943000+00:00,2026-04-10 19:58:10.933000+00:00,559.4,8,1,['Verify Silent Network Auth'],https://stspg.io/bgvrd74fjv1j,Twilio customers may be experiencing User Authentication Identity SNA and Gateway API errors for T-Mobile in the United States. Our team is actively investigating this issue. We will provide another u,3.0,Friday,2026-04-10,4.0,2026.0,True,1,2026-04,long
twilio,4mxjkxx848h9,On Call Engineers are Investigating,none,2026-04-10 19:01:52.288000+00:00,2026-04-10 19:21:32.478000+00:00,19.7,2,0,[],https://stspg.io/nq129705ppnq,Our monitoring systems have detected a potential issue with alarm event delivery. Our engineers have been alerted and are investigating. We will provide an update when we have more details.,12.0,Friday,2026-04-10,4.0,2026.0,False,2,2026-04,short
twilio,lfvbk05hbn1g,Flex AI Copilot Failures Generating Notes,minor,2026-04-10 14:54:51.174000+00:00,2026-04-10 18:36:28.035000+00:00,221.6,5,1,['Flex Agent Desktop'],https://stspg.io/hzf53kqt6yhl,Our monitoring systems have detected a potential issue with Flex AI Copilot Failures. Our engineers have been alerted and are investigating. We will provide an update when we have more details.,7.0,Friday,2026-04-10,4.0,2026.0,False,2,2026-04,long
twilio,19fgcndr5lcv,User Authentication Identity SNA Missing Redirects for Odido T-Mobile in Netherlands,minor,2026-04-07 23:23:52.343000+00:00,2026-04-10 14:10:29.148000+00:00,3766.6,14,1,['Verify Silent Network Auth'],https://stspg.io/5mm2n5rp8f1n,"Twilio customers may be experiencing User Authentication Identity SNA missing redirects for Odido T-Mobile in the Netherlands. Our team has identified the cause, and is working to resolve the issue. W",16.0,Tuesday,2026-04-07,4.0,2026.0,True,1,2026-04,long
twilio,l0658vh0v4ck,SMS Delivery Failures from a Subset of Twilio Long Codes to Telekom South Africa,none,2026-04-10 13:50:08.637000+00:00,2026-04-10 13:50:08.708000+00:00,0.0,1,1,"['SMS, Middle East & Africa']",https://stspg.io/lnp85n0fscd4,The incident has been resolved and SMS delivery from a subset of Twilio Long Codes to Telekom network subscribers in South Africa is operating normally.,6.0,Friday,2026-04-10,4.0,2026.0,False,1,2026-04,short
twilio,5jkwm0m2nk4k,SMS Delivery Delays from Twilio to Pelephone and Ramy Levy Israel,minor,2026-04-09 15:04:54.968000+00:00,2026-04-10 11:17:29.700000+00:00,1212.6,10,1,"['SMS, Middle East & Africa']",https://stspg.io/2hgs1ncd5lqz,Twilio customers may be experiencing SMS delivery delays from Twilio to Pelephone network subscribers in Israel. Our team is actively investigating this issue. We will provide another update in 1 hour,8.0,Thursday,2026-04-09,4.0,2026.0,True,2,2026-04,long
twilio,2j9b03y3wfs9,User Authentication Identity API High Latency in Multiple Countries Across North America and Latin America,minor,2026-04-10 06:39:13.202000+00:00,2026-04-10 09:32:41.659000+00:00,173.5,3,5,"['Lookup Identity Match', 'Lookup Line Type Intelligence [Legacy API]', 'Lookup Line Type Intelligence [Twilio API]', 'Lookup SIM Swap', 'Legacy Identity MatchAndAttributes']",https://stspg.io/m57g6nn53r51,"Twilio customers may be experiencing User Authentication Identity API high latency across multiple networks in USA, Brazil, Colombia across North America and Latin America. Our team is actively invest",23.0,Thursday,2026-04-09,4.0,2026.0,False,2,2026-04,long
twilio,cy2pqnl4tk12,SMS Delivery Delays from Twilio to Claro Peru,minor,2026-04-09 20:28:02.004000+00:00,2026-04-10 00:19:52.400000+00:00,231.8,4,1,"['SMS, Latin America']",https://stspg.io/6zbfrtvn0y73,Twilio customers may be experiencing SMS delivery delays from Twilio to Claro network subscribers in Peru. Our team is actively investigating this issue. We will provide another update in 1 hour or as,13.0,Thursday,2026-04-09,4.0,2026.0,False,1,2026-04,long
twilio,hy9q7729r5lc,Voice Call Failures between a Subset of Twilio Colombia Phone Numbers and Multiple Networks in Colombia,minor,2026-04-09 15:35:49.841000+00:00,2026-04-09 19:12:13.395000+00:00,216.4,4,1,"['Voice, Latin America']",https://stspg.io/z3nsngsdppfl,Twilio customers may be experiencing voice call failures between a subset of Twilio Colombia Phone Numbers and network subscribers in Colombia. Our team is actively investigating this issue. We will p,8.0,Thursday,2026-04-09,4.0,2026.0,False,2,2026-04,long
twilio,5ddrxl45hvwy,SMS Delivery Delays from Twilio to O2 Czech Republic,minor,2026-04-09 12:51:19.442000+00:00,2026-04-09 18:59:02.835000+00:00,367.7,7,1,"['SMS, Europe']",https://stspg.io/dbbxy2yqrnsk,Twilio customers may be experiencing SMS delivery delays from Twilio to O2 network subscribers in the Czech Republic. Our team is actively investigating this issue. We will provide another update in 1,5.0,Thursday,2026-04-09,4.0,2026.0,False,1,2026-04,long
twilio,bb26ljtw4fzr,SMS Delivery Delays from Twilio to T-Mobile Czech Republic,minor,2026-04-09 14:28:55.288000+00:00,2026-04-09 18:53:29.935000+00:00,264.6,5,1,"['SMS, Europe']",https://stspg.io/fbqt962b87v6,Twilio customers may be experiencing SMS delivery delays from Twilio to T-Mobile network subscribers in the Czech Republic. Our team is actively investigating this issue. We will provide another updat,7.0,Thursday,2026-04-09,4.0,2026.0,False,1,2026-04,long
twilio,p4l3nky96ljc,SMS Delivery Failures from Network Subscribers to a Subset of Twilio France Phone Numbers,minor,2026-04-09 12:51:07.008000+00:00,2026-04-09 16:26:26+00:00,215.3,4,1,"['SMS, Europe']",https://stspg.io/wty05rmh0kbf,Twilio customers may be experiencing SMS delivery failures from network subscribers to a subset of Twilio France Phone Numbers. Our team is actively investigating this issue. We will provide another u,5.0,Thursday,2026-04-09,4.0,2026.0,False,2,2026-04,long
twilio,cqs61n5bh5mk,SMS Delivery Delays and Delivery Receipt Delays from Twilio Short Codes to New Zealand,minor,2026-04-09 02:51:05.445000+00:00,2026-04-09 08:12:11.630000+00:00,321.1,5,1,"['SMS, APAC']",https://stspg.io/j676h738ghdq,Twilio customers may be experiencing SMS delivery delays and delivery receipt delays from a subset of Twilio Short Codes to New Zealand. Our team is actively investigating this issue. Message delivery,19.0,Wednesday,2026-04-08,4.0,2026.0,False,2,2026-04,long
twilio,sgl34l18tvsy,Billing Payment Processing for Mexican Peso Accounts,minor,2026-04-08 23:29:19.325000+00:00,2026-04-09 06:23:28.151000+00:00,414.1,7,1,['Billing'],https://stspg.io/7027g914d493,We are aware of an issue affecting payment processing for accounts using Mexican Peso currency. Customers may experience payment failures and account suspension when attempting to complete account upg,16.0,Wednesday,2026-04-08,4.0,2026.0,False,3,2026-04,long
twilio,dbpcv4ywkjb5,Mexico Customers Unable to Activate Their Accounts,minor,2026-04-09 02:07:39.024000+00:00,2026-04-09 03:13:15.061000+00:00,65.6,2,1,['Billing'],https://stspg.io/ldgl87r6lwhr,We are currently investigating an issue where some customers in Mexico using USD currency may experience problems with their account balance not updating successfully. This may result in account suspe,19.0,Wednesday,2026-04-08,4.0,2026.0,False,1,2026-04,long
twilio,l25v882v7s9w,SMS Delivery Delays and Failures To AT&T Mexico,minor,2026-04-08 09:58:51.127000+00:00,2026-04-08 12:40:06.768000+00:00,161.3,3,1,"['SMS, Latin America']",https://stspg.io/bthbffmfnd8v,We are experiencing SMS delivery delays when sending messages To AT&T Mexico. Our engineers are working with our carrier partner to resolve the issue. We will provide another update in 1 hour or as so,2.0,Wednesday,2026-04-08,4.0,2026.0,False,1,2026-04,long
twilio,qkxwkclqvt9p,SMS Delivery Delays and Failures from Twilio to AT&T Mexico,minor,2026-04-08 11:17:13.028000+00:00,2026-04-08 12:39:32.342000+00:00,82.3,2,1,"['SMS, Latin America']",https://stspg.io/9nbw1wcryscg,We have observed a recovery in SMS delivery from Twilio to AT&T network subscribers in Mexico and are monitoring service stability. We will provide another update in 2 hours or as soon as more informa,4.0,Wednesday,2026-04-08,4.0,2026.0,False,1,2026-04,long
twilio,8r0djtgzrtsr,SMS Delivery Receipt Delays and Delivery Failures from Twilio to DigiMobil (Movistar) Spain,minor,2026-04-08 08:34:01.123000+00:00,2026-04-08 11:54:31.677000+00:00,200.5,6,1,"['SMS, Europe']",https://stspg.io/8ydyls14zcb1,Twilio customers may be experiencing SMS delivery receipt delays and SMS delivery failures from Twilio to DigiMobil (Movistar) network subscribers in Spain. Our team is actively investigating this iss,1.0,Wednesday,2026-04-08,4.0,2026.0,False,3,2026-04,long
twilio,1t7m6z4l47ql,SMS Delivery Delays from Twilio to MTN Benin,minor,2026-04-07 15:33:58.436000+00:00,2026-04-08 08:31:43.724000+00:00,1017.8,7,1,"['SMS, Middle East & Africa']",https://stspg.io/q1p6zzzbn8f9,Twilio customers may be experiencing SMS delivery delays from Twilio to MTN network subscribers in Benin. Our team is actively investigating this issue. We will provide another update in 1 hour or as ,8.0,Tuesday,2026-04-07,4.0,2026.0,True,2,2026-04,long
twilio,2bt7tr7d1htp,SMS Delivery Delays from Twilio to Vodafone Egypt,minor,2026-04-07 16:22:22.898000+00:00,2026-04-07 21:23:33.351000+00:00,301.2,6,1,"['SMS, Middle East & Africa']",https://stspg.io/tsd3hc9z5bx9,Twilio customers may be experiencing SMS delivery delays from Twilio to Vodafone network subscribers in Egypt. Our team is actively investigating this issue. We will provide another update in 1 hour o,9.0,Tuesday,2026-04-07,4.0,2026.0,False,2,2026-04,long
twilio,3dkdcdt3pr2p,SMS Delivery Delays and Failures from Twilio to Multiple Networks in Brazil,minor,2026-04-07 14:27:37.276000+00:00,2026-04-07 20:58:06.081000+00:00,390.5,6,1,"['SMS, Latin America']",https://stspg.io/pkyc91hcqfkl,Twilio customers may be experiencing SMS delivery delays and failures from Twilio to network subscribers on multiple networks in Brazil. Our team is actively investigating this issue. We will provide ,7.0,Tuesday,2026-04-07,4.0,2026.0,False,2,2026-04,long
twilio,176cktw5thf2,SMS Delivery Delays from Twilio to Multiple Networks in Multiple Countries,minor,2026-04-07 16:40:42.792000+00:00,2026-04-07 20:05:31.472000+00:00,204.8,4,4,"['SMS, Latin America', 'SMS, APAC', 'SMS, Europe', 'SMS, Middle East & Africa']",https://stspg.io/60ryn2jhmmtl,Twilio customers may be experiencing SMS delivery delays from Twilio to network subscribers on multiple networks in multiple countries. Our team is actively investigating this issue. We will provide a,9.0,Tuesday,2026-04-07,4.0,2026.0,False,2,2026-04,long
twilio,jb762xp8gqbv,Programmable Messaging API Affected,none,2026-04-07 19:21:04.766000+00:00,2026-04-07 19:21:04.818000+00:00,0.0,1,1,['Programmable Messaging API'],https://stspg.io/2psw5jwhqvzd,"Twilio Programmable Messaging API was degraded for 40 seconds between 6:37:10 and 6:37:50 Pacific Time on April 7, 2026. During this period of time customers may have experienced elevated rate of HTTP",12.0,Tuesday,2026-04-07,4.0,2026.0,False,1,2026-04,short
twilio,vztwn9p7vv14,SMS Delivery Failures from Twilio to Etisalat Egypt,minor,2026-04-07 07:06:43.844000+00:00,2026-04-07 12:15:01.970000+00:00,308.3,4,1,"['SMS, Middle East & Africa']",https://stspg.io/cgxg8gd8psws,Twilio customers may be experiencing SMS delivery failures from Twilio to Etisalat network subscribers in Egypt. Our team is actively investigating this issue. We will provide another update in 1 hour,0.0,Tuesday,2026-04-07,4.0,2026.0,False,2,2026-04,long
twilio,qxjbl13l0h5s,SMS Delivery Delays from Twilio to Lycamobile Germany,minor,2026-04-06 22:52:47.826000+00:00,2026-04-07 01:48:11.480000+00:00,175.4,4,1,"['SMS, Europe']",https://stspg.io/xhgxwc0rrtrd,Twilio customers may be experiencing SMS delivery delays from Twilio to Lycamobile network subscribers in Germany. Our team is actively investigating this issue. We will provide another update in 1 ho,15.0,Monday,2026-04-06,4.0,2026.0,False,3,2026-04,long
twilio,d34jr5fj2wrp,SMS Delivery Failures from a Subset of Twilio Long Codes to WOM Colombia,minor,2026-04-06 22:01:19.571000+00:00,2026-04-07 00:36:49.787000+00:00,155.5,4,1,"['SMS, Latin America']",https://stspg.io/jh76jlpcvrxl,Twilio customers may be experiencing SMS delivery failures from a subset of Twilio Long Codes to WOM network subscribers in Colombia. Our team is actively investigating this issue. We will provide ano,15.0,Monday,2026-04-06,4.0,2026.0,False,3,2026-04,long
twilio,r8ms0zr23n4f,SMS Delivery Delays from Twilio to Mir Telecom and Tattelecom Russia,minor,2026-04-06 20:26:05.059000+00:00,2026-04-06 22:16:30.183000+00:00,110.4,5,1,"['SMS, Europe']",https://stspg.io/1w4z8ljygq7p,Our monitoring systems have detected a potential issue with SMS delivery delays. Our engineers have been alerted and are investigating. We will provide an update when we have more details.,13.0,Monday,2026-04-06,4.0,2026.0,False,4,2026-04,long
twilio,j4158fsg6pll,SMS Delivery Delays from Twilio to Telenor Pakistan,minor,2026-04-06 09:17:29.304000+00:00,2026-04-06 17:40:19.005000+00:00,502.8,7,1,"['SMS, APAC']",https://stspg.io/snsz1y6p2jgk,Twilio customers may be experiencing SMS delivery delays from Twilio to Telenor network subscribers in Pakistan. Our team is actively investigating this issue. We will provide another update in 1 hour,2.0,Monday,2026-04-06,4.0,2026.0,False,2,2026-04,long
twilio,jn0cxp6y15vj,SMS Delivery Failures from Network Subscribers to a Subset of Twilio Israel Phone Numbers,minor,2026-04-04 23:44:55.676000+00:00,2026-04-05 04:29:23.553000+00:00,284.5,4,1,"['SMS, Middle East & Africa']",https://stspg.io/mdmk8wnw5ss2,Twilio customers may be experiencing SMS delivery failures from network subscribers to a subset of Twilio Israel Phone Numbers. Our team is actively investigating this issue. We will provide another u,16.0,Saturday,2026-04-04,4.0,2026.0,False,2,2026-04,long
